,codigo_processo,meio_processo,natureza_processo,comarca,lista_ativos,lista_passivos,lista_advogados,conteudo
86,1000770-12.2018.8.26.0077,"Processo Digital. Petições para juntada devem ser apresentadas exclusivamente por meio eletrônico, nos termos do artigo 7º da Res. 551/2011",Apelação,Birigüi," Rosely dos Santos Anhê (Justiça 
Gratuita) ", Banco Mercantil do Brasil S/A ," Gabriel Reche Gelaleti (OAB: 351862/SP) - Fernando Antônio Fontanetti 
(OAB: 21057/SP) - Luiz Gastão de Oliveira Rocha (OAB: 35365/SP) - Páteo do Colégio - Sala 113"," Magistrado(a) Salles Vieira - Conheceram em parte do recurso e, na parte conhecida, negaram-lhe provimento. V.U.  - “APELAÇÃO  AÇÃO DE REPETIÇÃO DE INDÉBITO C.C. INDENIZAÇÃO POR DANOS MORAIS  CONTRATO DE CARTÃO DE CRÉDITO CONSIGNADO  INTERESSE RECURSAL  DECISÃO QUE NÃO ABORDOU EVENTUAL OCORRÊNCIA DE VENDA CASADA DE PRODUTOS BANCÁRIOS, MATÉRIA SEQUER AVENTADA EXPRESSAMENTE NA INICIAL - AUSÊNCIA DE INTERESSE RECURSAL RECONHECIDA  APELO NÃO CONHECIDO, NESTE ASPECTO.”“CARTÃO DE CRÉDITO CONSIGNADO  RMC  DESCONTOS INDEVIDOS  DEVOLUÇÃO EM DOBRO - DOCUMENTOS TRAZIDOS AOS AUTOS, PELA AUTORA, INDICAM QUE NÃO HOUVE DESCONTOS, EM SEU BENEFÍCIO 
PREVIDENCIÁRIO, PELA INSTITUIÇÃO FINANCEIRA, A TÍTULO DE RMC (RESERVA DE MARGEM CONSIGNÁVEL), VEZ 
QUE A AUTORA NÃO SE UTILIZOU DO CARTÃO DE CRÉDITO COLOCADO À SUA DISPOSIÇÃO  INCABÍVEL, PORTANTO, 
ACOLHER-SE A PRETENSÃO DE DEVOLUÇÃO EM DOBRO DE VALORES DEDUZIDA PELA APELANTE  DECISÃO MANTIDA  
APELO IMPROVIDO”.“INDENIZAÇÃO POR DANOS MORAIS  SUCUMBÊNCIA  OS FATOS NARRADOS PELA AUTORA 
NÃO ENSEJAM A PRETENDIDA REPARAÇÃO POR EVENTUAIS DANOS MORAIS SOFRIDOS  INSTITUIÇÃO FINANCEIRA 
QUE NÃO PRATICOU NENHUM ATO ILÍCITO  AUSÊNCIA DE OFENSA AOS DIREITOS DA PERSONALIDADE - APELO 
IMPROVIDO”. ART. 1007 CPC - EVENTUAL RECURSO - SE AO STJ: CUSTAS R$ 179,37 - (GUIA GRU NO SITE http://www.
stj.jus.br) - RESOLUÇÃO Nº 2 DE 01/02/2017 DO STJ -  SE AO STF: CUSTAS R$ 198,95 - GUIA GRU - COBRANÇA - FICHA 
DE COMPENSAÇÃO - (EMITIDA ATRAVÉS DO SITE www.stf.jus.br) E PORTE DE REMESSA E RETORNO R$ 98,00 - GUIA 
FEDTJ - CÓD 140-6 - BANCO DO BRASIL OU INTERNET - RESOLUÇÃO Nº 609 DE 23/04/2018 DO STF. Os valores referentes 
ao PORTE DE REMESSA E RETORNO, não se aplicam aos PROCESSOS ELETRÔNICOS, de acordo com o art. 4º, inciso II, da 
Resolução nº 609/2018 do STF de 23/04/2018. - 
(OAB: 21057/SP) - Luiz Gastão de Oliveira Rocha (OAB: 35365/SP) - Páteo do Colégio - Sala 113"
87,1039594-19.2015.8.26.0506,"Processo Digital. Petições para juntada devem ser apresentadas exclusivamente por meio eletrônico, nos termos do artigo 7º da Res. 551/2011",Apelação,Ribeirão Preto," Leonardo Camargo 
Baptista (Justiça Gratuita) ", Banco Bradesco S/A ," 
Marcos Cesar Chagas Perez (OAB: 123817/SP) - Fábio André Fadiga (OAB: 139961/SP) - Evandro Mardula (OAB: 258368/SP) 
- Páteo do Colégio - Sala 113"," Magistrado(a) Salles Vieira - Deram provimento ao recurso. V. U.  - “AÇÃO DECLARATÓRIA C.C. INDENIZATÓRIA  NEGATIVAÇÃO INDEVIDA  DANOS MORAIS - CARACTERIZADA RELAÇÃO DE CONSUMO  INVERSÃO DO ÔNUS DA PROVA  EMBORA OS DOCUMENTOS JUNTADOS PELO BANCO DEMONSTREM A EXISTÊNCIA DE RELAÇÃO NEGOCIAL ENTRE O AUTOR E O RÉU, NÃO COMPROVAM A EXISTÊNCIA DOS ESPECÍFICOS DÉBITOS QUE DERAM ENSEJO ÀS ANOTAÇÕES RESTRITIVAS  RECONHECIDA A ILEGALIDADE DAS INSCRIÇÕES DO NOME DO AUTOR NOS ÓRGÃOS DE PROTEÇÃO AO CRÉDITO  DECLARAÇÃO DE INEXIGIBILIDADE DOS DÉBITOS  FALHA NA PRESTAÇÃO DE SERVIÇOS  RESPONSABILIDADE OBJETIVA DO BANCO RÉU  DANO MORAL CARACTERIZADO - AINDA 
QUE NÃO HAJA PROVA DO PREJUÍZO, O DANO MORAL PURO É PRESUMÍVEL  INAPLICABILIDADE, AO CASO, DA SÚMULA 
Nº 385 DO STJ  ANOTAÇÃO PREEXISTENTE QUE JÁ FOI JUDICIALMENTE DECLARADA INEXIGÍVEL  INDENIZAÇÃO DEVIDA, 
DEVENDO SER FIXADA COM BASE EM CRITÉRIOS LEGAIS E DOUTRINÁRIOS  INDENIZAÇÃO FIXADA EM R$10.000,00, 
ANTE AS PECULIARIDADES DO CASO, QUANTIA SUFICIENTE PARA INDENIZAR O AUTOR E, AO MESMO TEMPO, 
COIBIR O RÉU DE ATITUDES SEMELHANTES  INDENIZAÇÃO ATUALIZADA COM CORREÇÃO MONETÁRIA, A CONTAR DO 
ACÓRDÃO, E JUROS MORATÓRIOS, A CONTAR DA CITAÇÃO  SÚMULA Nº 362 DO STJ  SENTENÇA REFORMADA  AÇÃO 
PROCEDENTE  ÔNUS SUCUMBENCIAIS CARREADOS AO RÉU  APELO PROVIDO.” ART. 1007 CPC - EVENTUAL RECURSO 
- SE AO STJ: CUSTAS R$ 179,37 - (GUIA GRU NO SITE http://www.stj.jus.br) - RESOLUÇÃO Nº 2 DE 01/02/2017 DO STJ -  SE 
AO STF: CUSTAS R$ 198,95 - GUIA GRU - COBRANÇA - FICHA DE COMPENSAÇÃO - (EMITIDA ATRAVÉS DO SITE www.
stf.jus.br) E PORTE DE REMESSA E RETORNO R$ 98,00 - GUIA FEDTJ - CÓD 140-6 - BANCO DO BRASIL OU INTERNET - 
RESOLUÇÃO Nº 609 DE 23/04/2018 DO STF. Os valores referentes ao PORTE DE REMESSA E RETORNO, não se aplicam 
aos PROCESSOS ELETRÔNICOS, de acordo com o art. 4º, inciso II, da Resolução nº 609/2018 do STF de 23/04/2018. - 
Marcos Cesar Chagas Perez (OAB: 123817/SP) - Fábio André Fadiga (OAB: 139961/SP) - Evandro Mardula (OAB: 258368/SP) 
- Páteo do Colégio - Sala 113"
88,0000595-24.2011.8.26.0451,Processo Físico,Apelação,Piracicaba," Fábio Bertolino (Justiça 
Gratuita) ", Spal Industria Brasileira de Bebidas Sa   Ace Seguradora S/A ,," Magistrado(a) Mourão Neto - Deram provimento em parte ao recurso. V. U.  - CONSUMIDOR E PROCESSUAL. AÇÃO DE INDENIZAÇÃO POR DANOS MATERIAIS (LUCROS CESSANTES) E MORAIS JULGADA IMPROCEDENTE. PRETENSÃO À REFORMA INTEGRAL MANIFESTADA PELO DEMANDANTE.  RESPONSABILIDADE OBJETIVA DO FABRICANTE POR LESÕES CORPORAIS SOFRIDAS PELO CONSUMIDOR, PROVOCADAS POR ACIDENTE COM GARRAFA DE REFRIGERANTE. EXCLUDENTES DE RESPONSABILIDADE NÃO COMPROVADAS. DANOS MORAIS CONFIGURADOS (IN RE IPSA). QUANTUM INDENIZATÓRIO ARBITRADO EM R$ 5.000,00 (CINCO MIL REAIS), CONSIDERANDO A DÚPLICE FUNÇÃO DA INDENIZAÇÃO DESSA NATUREZA E AS PARTICULARIDADES DO CASO CONCRETO. PENSÃO MENSAL QUE NÃO É DEVIDA, TENDO EM VISTA 
AS CONCLUSÕES DA PROVA PERICIAL MÉDICA. LIDE SECUNDÁRIA QUE DEVE SER JULGADA PROCEDENTE, SEM 
CONDENAÇÃO DA SEGURADORA DENUNCIADA AO PAGAMENTO DE HONORÁRIOS EM FAVOR DA RÉ DENUNCIANTE, 
PORQUE NÃO RESISTIU À DENUNCIAÇÃO. RECURSO PROVIDO EM PARTE. ART. 1007 CPC - EVENTUAL RECURSO - SE 
AO STJ: CUSTAS R$ 179,37 - (GUIA GRU NO SITE http://www.stj.jus.br) - RESOLUÇÃO Nº 2 DE 01/02/2017 DO STJ -  SE AO "
89,0000884-06.2015.8.26.0357,Processo Físico,Apelação,Mirante do Paranapanema," ELSO PEREIRA 
DA SILVA (Assistência Judiciária) ", DIEGO TEIXEIRA DA SILVA (Justiça Gratuita) ," Adilmar Alves de Oliveira (OAB: 26177/SP) (Convênio A.J/
OAB) - Renato Ramos (OAB: 251136/SP) - Vivian Roberta Marinelli (OAB: 157999/SP) - Conselheiro Furtado, nº 503 - 4º andar"," Magistrado(a) Mourão Neto - Negaram provimento ao recurso. V. U.  - CIVIL E PROCESSUAL. AÇÃO DE INDENIZAÇÃO POR DANOS MATERIAIS E MORAIS DECORRENTES DE ACIDENTE DE TRÂNSITO JULGADA PARCIALMENTE PROCEDENTE. PRETENSÃO DO RÉU À ANULAÇÃO OU À REFORMA.O PRAZO PARA OFERECIMENTO DA CONTESTAÇÃO TEM COMO TERMO INICIAL A DATA DA JUNTADA DO MANDADO DE CITAÇÃO CUMPRIDO (ART. 231, II, CPC/2015), NÃO TENDO RELEVO QUE O RÉU TENHA, ANTES, JUNTADO PROCURAÇÃO AOS AUTOS E DESNECESSARIAMENTE REQUERIDO VISTA DELES FORA DO CARTÓRIO.PRESUNÇÃO DE VERACIDADE DOS FATOS ALEGADOS PELO AUTOR (ART. 344, CPC/2015) QUE É CORROBORADA PELOS DEPOIMENTOS PRESTADOS NO PROCEDIMENTO INVESTIGATÓRIO INSTAURADO PELA 
POLÍCIA JUDICIÁRIA, INCLUSIVE O PRESTADO PELO PRÓPRIO DEMANDADO. ACIDENTE CAUSADO POR ANIMAL 
BOVINO SOLTO EM ESTRADA RURAL. RESPONSABILIDADE OBJETIVA DO DONO, NOS TERMOS DO ARTIGO 936 DO 
CÓDIGO CIVIL. DOCUMENTALMENTE COMPROVADOS OS DANOS MATERIAIS SOFRIDOS PELO DEMANDANTE, A 
INDENIZAÇÃO A ESSE TÍTULO É DEVIDA E NO MONTANTE POSTULADO.  LESÕES CORPORAIS SOFRIDAS EM ACIDENTE 
DE TRÂNSITO PROVOCAM DANOS MORAIS IN RE IPSA. QUANTUM INDENIZATÓRIO MANTIDO EM R$ 25.000,00 (VINTE 
E CINCO MIL REAIS), EM ATENÇÃO ÀS FUNÇÕES COMPENSATÓRIA E PEDAGÓGICA DA INDENIZAÇÃO A ESSE TÍTULO 
E ÀS PARTICULARIDADES DO CASO CONCRETO, EM ESPECIAL A GRAVIDADE DAS LESÕES SOFRIDAS PELO AUTOR. 
RECURSO DESPROVIDO.  ART. 1007 CPC - EVENTUAL RECURSO - SE AO STJ: CUSTAS R$ 179,37 - (GUIA GRU NO SITE 
http://www.stj.jus.br) - RESOLUÇÃO Nº 2 DE 01/02/2017 DO STJ -  SE AO STF: CUSTAS R$ 198,95 - GUIA GRU - COBRANÇA 
- FICHA DE COMPENSAÇÃO - (EMITIDA ATRAVÉS DO SITE www.stf.jus.br) E PORTE DE REMESSA E RETORNO R$ 98,00 
- GUIA FEDTJ - CÓD 140-6 - BANCO DO BRASIL OU INTERNET - RESOLUÇÃO Nº 609 DE 23/04/2018 DO STF. Os valores 
referentes ao PORTE DE REMESSA E RETORNO, não se aplicam aos PROCESSOS ELETRÔNICOS, de acordo com o art. 4º, 
inciso II, da Resolução nº 609/2018 do STF de 23/04/2018. - 
OAB) - Renato Ramos (OAB: 251136/SP) - Vivian Roberta Marinelli (OAB: 157999/SP) - Conselheiro Furtado, nº 503 - 4º andar"
90,0005098-24.2012.8.26.0655,Processo Físico,Apelação,Várzea Paulista,,,," Apte/Apdo: João Quirino Mecânica Me - Apdo/Apte: Hermann Fellinghauer (Justiça Gratuita) - Magistrado(a) Marcos Gozzo - Conheceram em parte do recurso do autor e, na parte conhecida, negaram-lhe provimento e negaram provimento ao recurso da ré. V.U.  - AÇÃO DE OBRIGAÇÃO DE FAZER CUMULADA COM INDENIZAÇÃO POR DANOS MATERIAIS E MORAIS. VEÍCULO UTILIZADO COMO INSUMO DA ATIVIDADE DA EMPRESA AUTORA. AFASTADA A APLICAÇÃO DAS NORMAS DO CDC. EMPRESA-REQUERIDA QUE IMPEDIU A RETIRADA DO VEÍCULO PELO AUTOR, SOB O FUNDAMENTO DE AUSÊNCIA DE PAGAMENTO DO PREÇO PELO CONSERTO. IMPOSSIBILIDADE. DANOS MORAIS CONFIGURADOS. AUTOR QUE SE VIU IMPEDIDO DE DISPOR E DE USUFRUIR DO BEM QUE LHE PERTENCIA PORQUE O RÉU ENTENDEU QUE ESTA SERIA A MANEIRA MAIS EFICAZ DE RECEBER OS VALORES QUE ENTENDIA DEVIDOS PELOS SERVIÇOS PRESTADOS. VALOR ARBITRADO EM R$ 10.000,00 
(DEZ MIL REAIS) QUE NÃO SE MOSTRA EXORBITANTE. REQUERENTE QUE TAMBÉM FOI OBRIGADO A ALUGAR OUTRO 
AUTO PARA DESEMPENHAR SUAS ATIVIDADES PROFISSIONAIS. VALORES LOCATIVOS DEVIDOS PELO PERÍODO QUE "
91,0000516-57.2012.8.26.0177,Processo Físico,Apelação,Embu-Guaçu, Mapre Seguros Gerais S/A , Anderson Baldini ," Paulo Affonso Ciari de Almeida Filho (OAB: 130053/SP) - Agnaldo Batista 
Garisto (OAB: 154024/SP) - Luciana Ramos Azam (OAB: 211318/SP) (Procurador) - Vanessa Diaz Domingues (OAB: 222086/
SP) - Cloves Alves de Souza (OAB: 213383/SP) - Venicio Borelli Filho (OAB: 97278/SP) - Afonso Henrique Almeida Nascimento 
(OAB: 221536/SP) - Conselheiro Furtado, nº 503 - 4º andar"," Magistrado(a) Marcos Gozzo - Deram provimento ao recurso. V. U.  - AÇÃO DE REPARAÇÃO. RESPONSABILIDADE CIVIL. ACIDENTE EM RODOVIA. INSURGÊNCIA DA SEGURADORA. DANOS MORAIS. MINORAÇÃO DA CONDENAÇÃO. VALOR ARBITRADO SEGUNDO OS PRINCÍPIOS DA RAZOABILIDADE E PROPORCIONALIDADE.RECURSO PROVIDO. ART. 1007 CPC - EVENTUAL RECURSO - SE AO STJ: CUSTAS R$ 179,37 - (GUIA GRU NO SITE http://www.stj.jus.br) - RESOLUÇÃO Nº 2 DE 01/02/2017 DO STJ -  SE AO STF: CUSTAS R$ 198,95 - GUIA GRU - COBRANÇA - FICHA DE COMPENSAÇÃO - (EMITIDA ATRAVÉS DO SITE www.stf.jus.br) E PORTE DE REMESSA E RETORNO R$ 161,20 - GUIA FEDTJ - CÓD 140-6 - BANCO DO BRASIL OU INTERNET - RESOLUÇÃO Nº 609 DE 23/04/2018 DO STF. Os valores referentes ao PORTE DE REMESSA E RETORNO, não se aplicam aos PROCESSOS ELETRÔNICOS, de acordo com o art. 4º, inciso II, da 
Resolução nº 609/2018 do STF de 23/04/2018. - 
Garisto (OAB: 154024/SP) - Luciana Ramos Azam (OAB: 211318/SP) (Procurador) - Vanessa Diaz Domingues (OAB: 222086/
SP) - Cloves Alves de Souza (OAB: 213383/SP) - Venicio Borelli Filho (OAB: 97278/SP) - Afonso Henrique Almeida Nascimento 
(OAB: 221536/SP) - Conselheiro Furtado, nº 503 - 4º andar"
92,4006577-96.2013.8.26.0477,"Processo Digital. Petições para juntada devem ser apresentadas exclusivamente por meio eletrônico, nos termos do artigo 7º da Res. 551/2011",Apelação,Praia Grande," ALBA VALERIA DANTAS SILVA 
(Justiça Gratuita) ", Via Varejo S/a( Nova Casa Bahia)   Mapfre Vida S/A ," 
Rosimeire Mian Caffaro (OAB: 226273/SP) - João Candido Martins Ferreira Leão (OAB: 143142/RJ) - Victor José Petraroli Neto 
(OAB: 31464/SP) - Ana Rita dos Reis Petraroli (OAB: 130291/SP) - Conselheiro Furtado, nº 503 - 4º andar"," Magistrado(a) Mourão Neto - Negaram provimento ao recurso. V. U.  - CONSUMIDOR E PROCESSUAL. AÇÃO DE COBRANÇA DE INDENIZAÇÃO SECURITÁRIA CUMULADA COM PEDIDO DE INDENIZAÇÃO POR DANOS MORAIS JULGADA IMPROCEDENTE. PRETENSÃO DA AUTORA À REFORMA. EMBRIAGUEZ DO SEGURADO QUE RESTOU DEMONSTRADA POR MEIO DE EXAME TOXICOLÓGICO. CIRCUNSTÂNCIAS DO ACIDENTE QUE INDICAM A RELAÇÃO DE CAUSA E EFEITO ENTRE O CONSUMO DE ÁLCOOL E O SINISTRO. INCIDÊNCIA DO ARTIGO 768 DO CÓDIGO CIVIL, SEGUNDO O QUAL “O SEGURADO PERDERÁ O DIREITO À GARANTIA SE AGRAVAR INTENCIONALMENTE O RISCO OBJETO DO CONTRATO”.CONSIDERAÇÃO, ADEMAIS, DE QUE 
SERIA INDEVIDA A INDENIZAÇÃO POR DANOS MORAIS, MESMO SE TIVESSE SIDO RECONHECIDA COMO INJUSTA A 
RECUSA ADMINISTRATIVA AO PAGAMENTO DA INDENIZAÇÃO SECURITÁRIA, CONFORME ORIENTAÇÃO DO C. SUPERIOR 
TRIBUNAL DE JUSTIÇA E DESTA E. CORTE ESTADUAL.RECURSO DESPROVIDO. ART. 1007 CPC - EVENTUAL RECURSO 
- SE AO STJ: CUSTAS R$ 179,37 - (GUIA GRU NO SITE http://www.stj.jus.br) - RESOLUÇÃO Nº 2 DE 01/02/2017 DO STJ -  SE 
AO STF: CUSTAS R$ 198,95 - GUIA GRU - COBRANÇA - FICHA DE COMPENSAÇÃO - (EMITIDA ATRAVÉS DO SITE www.
stf.jus.br) E PORTE DE REMESSA E RETORNO R$ 147,00 - GUIA FEDTJ - CÓD 140-6 - BANCO DO BRASIL OU INTERNET 
- RESOLUÇÃO Nº 609 DE 23/04/2018 DO STF. Os valores referentes ao PORTE DE REMESSA E RETORNO, não se aplicam 
aos PROCESSOS ELETRÔNICOS, de acordo com o art. 4º, inciso II, da Resolução nº 609/2018 do STF de 23/04/2018. - 
Rosimeire Mian Caffaro (OAB: 226273/SP) - João Candido Martins Ferreira Leão (OAB: 143142/RJ) - Victor José Petraroli Neto 
(OAB: 31464/SP) - Ana Rita dos Reis Petraroli (OAB: 130291/SP) - Conselheiro Furtado, nº 503 - 4º andar"
93,1002067-65.2017.8.26.0505,"Processo Digital. Petições para juntada devem ser apresentadas exclusivamente por meio eletrônico, nos termos do artigo 7º da Res. 551/2011",Apelação,Ribeirão Pires," Luan dos Santos 
Chaves ", Andreza Silva Pereira da Fonseca (Justiça Gratuita) ," Daniela Daiana da Silva (OAB: 379874/SP) - Márcio Loureiro (OAB: 178050/SP) - Fernando 
Marques dos Santos (OAB: 221202/SP) - São Paulo - SP"," Magistrado(a) Paulo Ayrosa - Negaram provimento ao recurso. V. U.  - ACIDENTE DE VEÍCULO  INDENIZAÇÃO POR DANOS MATERIAL E MORAL  COLISÃO FRONTAL EM RAZÃO DE TRANSPOSIÇÃO DE FAIXA CONTRÁRIA DE ROLAMENTO POR PARTE DO RÉU  CULPA EXCLUSIVA DESTE BEM CARACTERIZADA  DANO MORAL  COMPROVAÇÃO  VALOR DA INDENIZAÇÃO FIXADO DE ACORDO COM OS PARÂMETROS DA PROPORCIONALIDADE E RAZOABILIDADE  ARBITRAMENTO EM R$ 20.000,00  PARCIAL PROCEDÊNCIA DA AÇÃO  CONFIRMAÇÃO POR SEUS FUNDAMENTOS  ART. 252 DO RITJSP  RECURSO NÃO PROVIDO. NÃO TRAZENDO O REQUERIDO FUNDAMENTOS SUFICIENTES A MODIFICAR A SENTENÇA DE PRIMEIRO GRAU, QUE RECONHECEU A 
PARCIAL PROCEDÊNCIA DA AÇÃO AO AFASTAR O PLEITO VOLTADO AOS DANOS MATERIAIS E ACOLHER O PEDIDO DE 
INDENIZAÇÃO POR DANOS MORAIS, ALÉM DE TER SIDO COMPROVADA SUA CULPA EXCLUSIVA PARA A OCORRÊNCIA 
DO ACIDENTE DE TRÂNSITO, DE RIGOR A MANUTENÇÃO INTEGRAL DA SENTENÇA, CUJOS FUNDAMENTOS SE 
ADOTAM COMO RAZÃO DE DECIDIR NA FORMA DO ART. 252 DO REGIMENTO INTERNO DESTE TRIBUNAL. ART. 1007 
CPC - EVENTUAL RECURSO - SE AO STJ: CUSTAS R$ 179,37 - (GUIA GRU NO SITE http://www.stj.jus.br) - RESOLUÇÃO Nº 
2 DE 01/02/2017 DO STJ -  SE AO STF: CUSTAS R$ 198,95 - GUIA GRU - COBRANÇA - FICHA DE COMPENSAÇÃO - (EMITIDA 
ATRAVÉS DO SITE www.stf.jus.br) E PORTE DE REMESSA E RETORNO R$ 116,20 - GUIA FEDTJ - CÓD 140-6 - BANCO 
DO BRASIL OU INTERNET - RESOLUÇÃO Nº 609 DE 23/04/2018 DO STF. Os valores referentes ao PORTE DE REMESSA E 
RETORNO, não se aplicam aos PROCESSOS ELETRÔNICOS, de acordo com o art. 4º, inciso II, da Resolução nº 609/2018 
do STF de 23/04/2018. - 
Marques dos Santos (OAB: 221202/SP) - São Paulo - SP"
94,1003009-38.2017.8.26.0266,"Processo Digital. Petições para juntada devem ser apresentadas exclusivamente por meio eletrônico, nos termos do artigo 7º da Res. 551/2011",Apelação,Itanhaém," José da Cruz de Jesus 
(Justiça Gratuita) ", Volkswagen do Brasil Indústria de Veículos Automotores Ltda ," Eduardo Alberto Kersevani Tomas 
(OAB: 140731/SP) - Marcelo Pereira de Carvalho (OAB: 138688/SP) - São Paulo - SP"," Magistrado(a) Carlos Nunes - Não conheceram do recurso. V. U.  - BEM MÓVEL - COMPRA E VENDA DE VEÍCULO - AÇÃO DECLARATÓRIA DE NULIDADE CONTRATUAL C/C INDENIZAÇÃO POR DANOS MORAIS  R. SENTENÇA MONOCRÁTICA QUE JULGOU IMPROCEDENTES OS PEDIDOS DO AUTOR - JULGAMENTO DO RECURSO DE AGRAVO DE INSTRUMENTO PELA COLENDA 34ª CÂMARA DE DIREITO PRIVADO, O QUE A TORNA PREVENTA PARA JULGAMENTO DO PRESENTE RECLAMO  APLICAÇÃO DO ARTIGO 105, § 3º, DO REGIMENTO INTERNO DA CASA -  RECURSO NÃO CONHECIDO - DECLINAÇÃO DE COMPETÊNCIA “EX OFFICIO”, DETERMINANDO A REDISTRIBUIÇÃO DO FEITO PARA A 34ª CÂMARA DE DIREITO PRIVADO, NA PESSOA 
DO EXMO. DES. SOARES LEVADA.  ART. 1007 CPC - EVENTUAL RECURSO - SE AO STJ: CUSTAS R$ 179,37 - (GUIA 
GRU NO SITE http://www.stj.jus.br) - RESOLUÇÃO Nº 2 DE 01/02/2017 DO STJ -  SE AO STF: CUSTAS R$ 198,95 - GUIA 
GRU - COBRANÇA - FICHA DE COMPENSAÇÃO - (EMITIDA ATRAVÉS DO SITE www.stf.jus.br) E PORTE DE REMESSA E 
RETORNO R$ 129,40 - GUIA FEDTJ - CÓD 140-6 - BANCO DO BRASIL OU INTERNET - RESOLUÇÃO Nº 609 DE 23/04/2018 
DO STF. Os valores referentes ao PORTE DE REMESSA E RETORNO, não se aplicam aos PROCESSOS ELETRÔNICOS, 
de acordo com o art. 4º, inciso II, da Resolução nº 609/2018 do STF de 23/04/2018. - 
(OAB: 140731/SP) - Marcelo Pereira de Carvalho (OAB: 138688/SP) - São Paulo - SP"
95,1005712-95.2017.8.26.0506,"Processo Digital. Petições para juntada devem ser apresentadas exclusivamente por meio eletrônico, nos termos do artigo 7º da Res. 551/2011",Apelação,Ribeirão Preto," Claudio Hilario Leopoldino 
(Justiça Gratuita) ", BANCO RCI BRASIL S.A. ," Jair Moyzés 
Ferreira Júnior (OAB: 121910/SP) - Ana Lúcia Martins dos Santos (OAB: 122249/SP) - Adriana D’ Avila Oliveira (OAB: 313184/
SP) - São Paulo - SP"," Magistrado(a) Paulo Ayrosa - Negaram provimento ao recurso. V. U.  - ARRENDAMENTO MERCANTIL  AÇÃO COMINATÓRIA C/C INDENIZAÇÃO POR DANOS MORAIS  DESBLOQUEIO JUDICIAL DO VEÍCULO  DEMORA RAZOÁVEL  AÇÃO IMPROCEDENTE  RECURSO NÃO PROVIDO. CONSIDERANDO-SE QUE NÃO HOUVE DEMORA EXCESSIVA E IMPUTÁVEL AO BANCO NO TOCANTE AO DESBLOQUEIO JUDICIAL DO VEÍCULO, ALÉM DO MESMO TER SE REALIZADO LOGO APÓS O PEDIDO FEITO NA AÇÃO DE REINTEGRAÇÃO DE POSSE NO QUAL OCORREU, INEXISTE DANO MORAL A SER INDENIZÁVEL. ART. 1007 CPC - EVENTUAL RECURSO - SE AO STJ: CUSTAS R$ 179,37 - (GUIA GRU NO SITE http://www.stj.jus.br) - RESOLUÇÃO Nº 2 DE 01/02/2017 DO STJ -  SE AO STF: CUSTAS 
R$ 198,95 - GUIA GRU - COBRANÇA - FICHA DE COMPENSAÇÃO - (EMITIDA ATRAVÉS DO SITE www.stf.jus.br) E PORTE 
DE REMESSA E RETORNO R$ 129,40 - GUIA FEDTJ - CÓD 140-6 - BANCO DO BRASIL OU INTERNET - RESOLUÇÃO Nº 
609 DE 23/04/2018 DO STF. Os valores referentes ao PORTE DE REMESSA E RETORNO, não se aplicam aos PROCESSOS 
ELETRÔNICOS, de acordo com o art. 4º, inciso II, da Resolução nº 609/2018 do STF de 23/04/2018. - 
Ferreira Júnior (OAB: 121910/SP) - Ana Lúcia Martins dos Santos (OAB: 122249/SP) - Adriana D’ Avila Oliveira (OAB: 313184/
SP) - São Paulo - SP"
96,1006897-04.2017.8.26.0011,"Processo Digital. Petições para juntada devem ser apresentadas exclusivamente por meio eletrônico, nos termos do artigo 7º da Res. 551/2011",Apelação,São Paulo," CVC Brasil Operadora 
e Agência de Viagens S.A. e outro ", Renata Soares de Rapyo (Justiça Gratuita) ," 
Jorge Donizeti Sanchez (OAB: 73055/SP) - Isabelle Caroline Strobel Silva (OAB: 352465/SP) - Igor Denisard Dantas Melo (OAB: 
366679/SP) - São Paulo - SP"," Magistrado(a) Paulo Ayrosa - Negaram provimento ao recurso. V. U.  - TURISMO  AÇÃO DE INDENIZAÇÃO POR DANOS MATERIAIS E MORAIS  FALHA NA PRESTAÇÃO DE SERVIÇOS  HOTEL DE PÉSSIMA QUALIDADE  RESPONSABILIDADE SOLIDÁRIA DA AGÊNCIA E DA OPERADORA DE TURISMO  AÇÃO PROCEDENTE  RECURSO NÃO PROVIDO. AS RÉS RESPONDEM SOLIDARIAMENTE PELOS DANOS CAUSADOS À AUTORA, POIS O PACOTE DE VIAGEM, INCLUINDO O PÉSSIMO HOTEL, FOI CONTRATADO ATRAVÉS DELAS. COMPROVADOS OS DANOS ALEGADOS, DEVIDA A INDENIZAÇÃO, MANTENDO-SE A PROCEDÊNCIA DA AÇÃO.INDENIZAÇÃO POR DANOS MORAIS PARÂMETROS PARA FIXAÇÃO  PROPORCIONALIDADE E RAZOABILIDADE. 
A QUANTIFICAÇÃO DA COMPENSAÇÃO DERIVADA DE DANO MORAL DEVE LEVAR EM CONSIDERAÇÃO O GRAU DA 
CULPA E A CAPACIDADE CONTRIBUTIVA DO OFENSOR, A EXTENSÃO DO DANO SUPORTADO PELA VÍTIMA E A SUA 
PARTICIPAÇÃO NO FATO, DE TAL SORTE A CONSTITUIR EM UM VALOR QUE SIRVA DE BÁLSAMO PARA A HONRA 
OFENDIDA E DE PUNIÇÃO AO OFENSOR, DESESTIMULANDO-O E A TERCEIROS A TER COMPORTAMENTO IDÊNTICO. 
NO CASO DOS AUTOS, O VALOR DA INDENIZAÇÃO DEVE SER MANTIDO. ART. 1007 CPC - EVENTUAL RECURSO - SE 
AO STJ: CUSTAS R$ 179,37 - (GUIA GRU NO SITE http://www.stj.jus.br) - RESOLUÇÃO Nº 2 DE 01/02/2017 DO STJ -  SE AO 
STF: CUSTAS R$ 198,95 - GUIA GRU - COBRANÇA - FICHA DE COMPENSAÇÃO - (EMITIDA ATRAVÉS DO SITE www.stf.
jus.br) E PORTE DE REMESSA E RETORNO R$ 116,20 - GUIA FEDTJ - CÓD 140-6 - BANCO DO BRASIL OU INTERNET - 
RESOLUÇÃO Nº 609 DE 23/04/2018 DO STF. Os valores referentes ao PORTE DE REMESSA E RETORNO, não se aplicam 
aos PROCESSOS ELETRÔNICOS, de acordo com o art. 4º, inciso II, da Resolução nº 609/2018 do STF de 23/04/2018. - 
Jorge Donizeti Sanchez (OAB: 73055/SP) - Isabelle Caroline Strobel Silva (OAB: 352465/SP) - Igor Denisard Dantas Melo (OAB: 
366679/SP) - SP"
97,1020792-90.2016.8.26.0100,"Processo Digital. Petições para juntada devem ser apresentadas exclusivamente por meio eletrônico, nos termos do artigo 7º da Res. 551/2011",Apelação,São Paulo," Edimilson da Costa 
Gomes (Justiça Gratuita) ", Casas Bahia Comercial Ltda. ,," Magistrado(a) Carlos Nunes - Rejeitada a preliminar, negaram provimento, nos termos que constarão do acórdão. V. U.  - PRELIMINAR DE NÃO IMPUGNAÇÃO ESPECÍFICA DOS FUNDAMENTOS DA SENTENÇA  INOCORRÊNCIA  O RECURSO DEMONSTROU OS MOTIVOS DE SUPOSTO DESACERTO DA SENTENÇA, INDICANDO, AO LONGO DA NARRATIVA ARGUMENTATIVA, OS ERRORES IN JUDICANDO  OBSERVÂNCIA DO PRINCÍPIO DA DIALETICIDADE DOS RECURSOS  PRELIMINAR REJEITADA.BEM MÓVEL  AÇÃO DE INDENIZAÇÃO POR DANOS MORAIS COM PEDIDO DE TUTELA ANTECIPADA – INCLUSÃO DO NOME DO AUTOR NOS ÓRGÃOS DE PROTEÇÃO AO CRÉDITO  ALEGAÇÃO DE INEXISTÊNCIA DE RELAÇÃO JURÍDICA ENTRE AS PARTES  PROVAS DOCUMENTAIS 
TRAZIDAS PELA REQUERIDA QUE CONFIRMAM A CELEBRAÇÃO DE CONTRATO ENTRE AS PARTES E ESPECIFICAM A 
INADIMPLÊNCIA  AINDA QUE SEJAM APLICÁVEIS OS DISPOSITIVOS CONSUMERISTAS AO CASO VERTENTE, TENDO A 
REQUERIDA SE DESINCUMBIDO DO ÔNUS DE PROVAR FATO IMPEDITIVO DO DIREITO ALEGADO PELO REQUERENTE, 
OUTRA NÃO PODERIA SER A SOLUÇÃO DA DEMANDA, SENÃO O DECRETO DE IMPROCEDÊNCIA  DANOS MORAIS NÃO 
CONFIGURADOS  CONDENAÇÃO DO AUTOR À PENA POR LITIGÂNCIA ÍMPROBA, NO MONTANTE DE 10% SOBRE O VALOR 
DA CAUSA, POR ALTERAÇÃO DA VERDADE DOS FATOS  CABIMENTO DA CONDENAÇÃO  SENTENÇA DE IMPROCEDÊNCIA 
MANTIDA  RECURSO IMPROVIDO. ART. 1007 CPC - EVENTUAL RECURSO - SE AO STJ: CUSTAS R$ 179,37 - (GUIA GRU 
NO SITE http://www.stj.jus.br) - RESOLUÇÃO Nº 2 DE 01/02/2017 DO STJ -  SE AO STF: CUSTAS R$ 198,95 - GUIA GRU - "
