,codigo_processo,meio_processo,natureza_processo,comarca,lista_ativos,lista_passivos,lista_advogados,conteudo
0,0006375-20.2014.8.26.0101,Processo Físico,Apelação,Caçapava, Diogo Gonçalves Soares ," 
S.H. Empreendimentos Imobiliários Ltda "," Cristiano Cesar de Andrade 
de Assis (OAB: 225216/SP) - Elias José David Nasser (OAB: 351113/SP) - Pátio do Colégio, sala 315"," Vistos. Inadmissível, por ora, o julgamento parcial pretendido pelo apelante. Sobre a possibilidade de se exigir o arbitramento de lucros cessantes com a cobrança da multa estabelecida judicialmente, necessário se aguardar a definição do recurso afetado pelo C. STJ, por meio do qual se definirá “acerca da possibilidade de cumulação ou não da indenização por lucros cessantes com a cláusula penal, nos casos de inadimplemento do vendedor em virtude do atraso na entrega de imóvel em construção objeto de contrato ou promessa de compra e venda (ProAfR no RECURSO ESPECIAL Nº 1.635.428, Rel. Min. Luis Felipe Salomão). Sobre os danos morais, maior cautela se exige na análise dessa pretensão indenizatória, notadamente quando afirmado, em grau recursal, que “até a presente data a recorrida não cumpriu com sua obrigação” (fls. 132). Esse fato, às claras, contribui na análise do pedido indenizatório, devendo ser considerado por força do 
art. 933 do CPC. Por tudo isso, aguarde-se o julgamento do referido recurso especial, renovando-se a conclusão assim que 
estabelecida a definição jurídica sobre a cumulação da indenização com a cláusula penal, oportunidade em que a Câmara se 
debruçará sobre a integralidade dos pleitos recursais. Int. - Magistrado(a) Donegá Morandini - 
de Assis (OAB: 225216/SP) - Elias José David Nasser (OAB: 351113/SP) - Pátio do Colégio, sala 315"
1,0005310-90.2014.8.26.0197,Processo Físico,Apelação,Francisco Morato," Clínica Odontológica Simplan 
S/A ", Maria Aparecida Delfino de Castro ," Fabio Plantulli (OAB: 130798/SP) - Daniel Zarenczansky (OAB: 331291/SP) - Aldieris 
Costa Dias (OAB: 297036/SP) - Pátio do Colégio, sala 515"," Vistos. Trata-se de ação de rescisão contratual cc indenização por dano material e moral ajuizada por MARIA APARECIDA DELFINO DE CASTRO em face de CLÍNICA ODONTOLÓGICA SIMPLAN S/A, que foi julgada parcialmente procedente, afastando os danos morais e condenando a ré ao ressarcimento do valor de R$ 10.166,66 (fls. 215/220). Inconformada, apela a ré (fls. 237/250), alegando que o tratamento da autora era complexo, sendo realizada intervenção cirúrgica para a instalação de 6 implantes e que seria necessário aguardar a recuperação do paciente para o prosseguimento do tratamento protético, razão pela qual o tratamento permaneceu temporariamente sobrestado. Assevera que com o retorno do tratamento, foram realizadas várias consultas para a coleta de provas para assegurar a perfeita instalação da prótese e que, após autorizar a finalização dos testes laborariais, a autora abandonou o tratamento. Aduz que a perícia realizada 
nos autos concluiu que os serviços prestados foram tecnicamente perfeitos e que o Juízo a quo não considerou que o serviço 
não foi concluído, em razão do abandono da autora, sendo que não houve interrupção do serviço nem dificuldades para o 
agendamento de consultas. Requer a improcedência da ação. Subsidiariamente pugna pela condenação apenas no valor de R$ 
6.000,00 referente à prótese definitiva e a condenação da apelada no ônus da sucumbência. Contrarrazões apresentadas às fls. 
257/262. É O RELATÓRIO DO NECESSÁRIO. Não se vislumbra que as questões delimitadas no pedido inicial estejam insertas 
nas competências desta Seção de Direito Privado. É que trata-se de ação de rescisão contratual cc indenizatória, oriunda de 
eventual responsabilidade do réu em reparar a autora a quantia por ela despendida com o pagamento da prestação de serviços 
odontológicos, alegando que o mesmo não foi realizado, na qual não se discute responsabilidade civil por erro odontológico. O 
recurso não pode ser conhecido por esta C. Câmara, uma vez que a competência para processar e julgar a matéria do recurso 
interposto é de uma das Câmaras que compõem as Subseções de Direito Privado II e III, quais sejam 11ª a 38ª Câmaras, 
conforme determinado pela Resolução TJ 623/2013, do Órgão Especial do E. Tribunal de Justiça. Dispõe o artigo 5º, §1º da 
Resolução nº 623/2013 do Órgão Especial deste E. Tribunal de Justiça, que são de competência das Câmaras da Segunda e 
Terceira Subseção de Direito Privado as “relativas à locação ou prestação de serviços, regidas pelo Direito Privado, inclusive as 
que envolvam obrigações irradiadas de contratos de prestação de serviços escolares e de fornecimento de água, gás, energia 
elétrica e telefonia”. Nesse sentido: Competência recursal. Ação declaratória de rescisão contratual decorrente de contrato de 
prestação de serviços. Matéria afeta à competência das Subseções de Direito Privado II e III. Artigo 5º, § 1º, da Resolução 
623/2013. Recurso não conhecido. (TJSP -  Apelação  -  Relator (a): Maia da Cunha -  Órgão Julgador: 
4ª Câmara de Direito Privado -  Foro de Santos - 11ª Vara Cível -  Data do Julgamento: 22/02/2018 -  Data de Registro: 26/02/2018). 
COMPETÊNCIA RECURSAL Ação de cobrança em fase de cumprimento de sentença Relação oriunda de contrato de prestação 
de serviço Competência das 11ª a 38ª Câmaras de Direito Privado - Resolução nº 623/2013, art. 5º, § 1º - Recurso de apelação 
interposto na referida ação julgado pela 14ª Câmara de Direito Privado - Dúvida de competência suscitada. RECURSO NÃO 
CONHECIDO. (TJSP -  Agravo de Instrumento  -  Relator (a): Clara Maria Araújo Xavier; Órgão 
Julgador: 8ª Câmara de Direito Privado; Foro de São José dos Campos - 5ª Vara Cível; Data do Julgamento: 26/02/2018; Data 
de Registro: 26/02/2018). Processual. Competência recursal. Embargos opostos a execução fundada em título extrajudicial 
(contrato de prestação de serviços contábeis). Matéria afeta à Segunda Subseção de Direito Privado do E. Tribunal de Justiça 
de São Paulo (11ª a 24ª, 37ª e 38ª Câmaras). Resolução nº 623/2013 do TJSP (art. 5º, II.3). Precedentes do C. Órgão Especial, 
bem como do C. Grupo Especial de Direito Privado. Agravo não conhecido, com determinação de redistribuição. (TJSP; 
Agravo de Instrumento ; Relator (a):Fabio Tabosa; Órgão Julgador: 29ª Câmara de Direito Privado; 
Foro Central Cível - 37ª Vara Cível; Data do Julgamento: 28/02/2018; Data de Registro: 28/02/2018). APELAÇÃO. AÇÃO DE 
INDENIZAÇÃO POR DANOS MORAIS E MATERIAIS - Parcial procedência da ação - prestação de serviços odontológicos- 
Alegação de que os serviços não foram prestados - Competência comum das Segunda e Terceira Subseções de Direito Privado 
- Art. 5º, par. 1º, Resolução 623/2013 TJ/SP - Conflito suscitado para restabelecer a distribuição prévia à 30ª Câmara de Direito 
Privado - Recurso não conhecido - Conflito suscitado. (TJSP;  Apelação ; Relator (a): Maria Salete 
Corrêa Dias; Órgão Julgador: 6ª Câmara de Direito Privado; Foro Central Cível - 7ª Vara Cível; Data do Julgamento: 02/05/2018; 
Data de Registro: 02/05/2018).- grifei Portanto, inviável se afigura o processamento do recurso por esta Câmara conforme 
determinado pela Resolução 623/2013 em seu artigo 5º, §1º, motivo pelo qual de rigor a redistribuição do feito para uma das 
Câmaras integrantes das Subseções de Direito Privado II e III. Posto isto, NÃO CONHEÇO DO RECURSO e, nos termos do 
art. 168, § 3º do RI/TJSP, determino sua redistribuição a uma das Câmaras que compõem a Subseção de Direito Privado II e 
III. - Magistrado(a) Ana Maria Baldy - 
Costa Dias (OAB: 297036/SP) - Pátio do Colégio, sala 515"
2,1040828-25.2017.8.26.0002,"Processo Digital. Petições para juntada devem ser apresentadas exclusivamente por meio eletrônico, nos termos do artigo 7º da Res. 551/2011",Apelação,São Paulo, Itaú Unibanco S/A ," 
Anesio Pereira Marques (Justiça Gratuita) ",," Decisão Monocrática nº 1512 Apelação. Seguro habitacional. Ação de repetição de indébito c.c. pedido de reparação de danos morais e materiais. Pretensão de recebimento dos valores indevidamente descontados. Matéria afeta a uma das C. Câmaras dentre aquelas numeradas entre a 1ª e 10ª, da Seção de Direito Privado. Inteligência do art. 5º, I, I.22, da Resolução nº 623/2013. Recurso não conhecido, com determinação de redistribuição da ação. Trata-se de recurso de apelação (fls. 128/135) contra sentença de parcial procedência de fls. 121/126, proferida nos autos da presente ação de repetição de indébito c.c. pedido de reparação de danos morais e materiais que condenou o réu: a) a restituir ao autor, na forma simples, os valores descontados com base no seguro residência de apólice nº 33.14.016048604.0000000, 
a título de danos materiais, observando-se que já foi efetuada a devolução de R$ 295,76 -  b) a pagar indenização no valor de 
R$ 5.000,00 (cinco mil reais) a título de danos morais, bem como, as despesas processuais e honorários advocatícios no valor 
equivalente a 10% (dez por cento) do valor da condenação. O réu recorre e pleiteia o provimento do recurso para que seja 
reformada a sentença e julgada improcedente a demanda, afastando a condenação e, alternativamente, pugna pela a aplicação 
de juros de mora a partir do arbitramento, conforme previsão expressa no artigo 407, do Código Civil. Vieram aos autos as 
contrarrazões (fls. 141/143). É o relatório. O recurso não pode ser conhecido. O autor alega que constatou a existência de 
descontos indevidos na conta corrente que possui no Banco réu e, após contata-lo, foi informado de que aqueles se referiam 
ao pagamento de seguro residencial. Contudo, em razão de já possuir seguro sobre este bem imóvel, e por não ter solicitado 
outro, pleiteia a devolução, em dobro, dos valores indevidamente descontados de sua conta, como também, a condenação do 
réu a indenizar os danos morais. Dispõe o artigo 5º, inciso I.22, da Resolução nº 623/2013 que é de competência da Subseção 
de Direito Privado I: “I - Primeira Subseção, composta pelas 1ª a 10ª Câmaras, com competência preferencial para o julgamento 
das seguintes matérias: (...) I.22 - Ações e execuções relativas a seguro habitacional - ” Confira-se, a respeito, precedentes desta 
C. Corte de Justiça: APELAÇÃO - Contrato de seguro habitacional - Incêndio - Prêmio não pago - Pretensão de recebimento 
dos valores contratualmente estabelecidos, cumulado com indenização por danos morais -Incompetência desta C. Câmara - 
Matéria afeta a uma das C. Câmaras dentre aquelas numeradas entre a 1ª e 10ª, da Seção de Direito Privado -Inteligência do 
art. 5º, I, I.22, da Resolução nº 623/2013 e do art. 103, do RITJ - Precedentes - Competência em razão da matéria e, portanto, 
absoluta - Recurso não conhecido, com determinação de remessa dos autos à Primeira Subseção de Direito Privado deste 
E. Tribunal. (TJSP -  19ª Câmara de Direito Privado -  Apelação  -  Rel. Des. Cláudia Grieco Tabosa 
Pessoa -  j. 04/09/2017) Competência recursal. Ação declaratória c.c. pedido de repetição do indébito e indenização por danos "
3,1011238-05.2014.8.26.0100,"Processo Digital. Petições para juntada devem ser apresentadas exclusivamente por meio eletrônico, nos termos do artigo 7º da Res. 551/2011",Apelação,São Paulo, LUCIANA KLEMP REGO , Ebc ,," Soluções Imobiliárias Ltda - DECISÃO MONOCRÁTICA N. 16.018 Civil. Ação declaratória de inexigibilidade de débito cumulada com pedidos indenizatórios. Sentença de improcedência. Pretensão à reforma manifestada pela autora. Indeferimento da gratuidade de justiça e determinação, não cumprida, para realização do preparo no prazo de 5 (cinco) dias, sob pena de não conhecimento do apelo. Deserção caracterizada. RECURSO NÃO CONHECIDO. 1. Trata-se de recurso de apelação interposto por Luciana Klemp Rego contra a sentença de fls. 77/79 que julgou improcedente a ação declaratória de inexigibilidade de débito cumulada com pedidos indenizatórios que moveu em face de EBC Soluções Imobiliárias Ltda. As razões recursais postulam, preliminarmente, a concessão do benefício de justiça gratuita, e, no mérito, a reforma da sentença, para 
que a ação seja julgada totalmente procedente. (fls. 86/97). Contrarrazões de apelação às fls. 100/118. Em necessário e prévio 
juízo de admissibilidade (que por força do CPC, ora em vigor, cabe a este relator (artigo 1.010, § 3º, e 1.011, inciso I), proferi a 
decisão de fls. 120, indeferindo os benefícios de justiça gratuita, e determinando à apelante a comprovação nos autos, no prazo 
de 5 (cinco) dias, do recolhimento do preparo, sob pena de deserção. Essa determinação não foi atendida, conforme certidão 
exarada a fls. 122. 2. A apelação se sujeita à disciplina do Código de Processo Civil de 2015 (a sentença foi disponibilizada 
liberada nos autos digitais em 22 de novembro de 2016) e não pode ser conhecida. Nos termos do artigo 1.007, caput, do 
mencionado diploma processual “no ato de interposição do recurso, o recorrente comprovará, quando exigido pela legislação 
pertinente, o respectivo preparo, inclusive porte de remessa e de retorno, sob pena de deserção”. Já o artigo 101, caput e § 
2º, do mesmo diploma legal, determina que, indeferido o pedido de gratuidade, o relator determinará ao recorrente, no prazo 
de 5 (cinco) dias, o recolhimento do preparo, sob pena de não conhecimento do recurso. Bem por isso, no caso em exame, 
indeferida a fls. 120 a gratuidade de justiça requerida pela apelante, foi determinada a realização do preparo no prazo legal de 
cinco dias. Porém, como essa determinação não foi atendida, conforme certificado a fls. 122, imperativo é o reconhecimento da 
deserção, que impede o conhecimento deste apelo, como se colhe dos seguintes arestos deste E. Tribunal de Justiça, mutatis 
mutandis: RECURSO Apelação “Ação declaratória de obrigação de fazer c. c. pedido de tutela antecipada e danos morais” 
Insurgência contra a r. sentença que julgou improcedente a demanda Indeferimento da justiça gratuita e concessão de prazo 
para recolhimento das custas, sob pena de deserção Recolhimento apenas da taxa judiciária Conferida nova oportunidade 
para comprovar o recolhimento da taxa de porte de remessa e de retorno, a apelante manteve-se inerte Deserção configurada 
Inteligência do artigo 1007, § 2º, do Novo CPC Recurso não conhecido. (18ª Câmara de Direito Privado Apelação n. 0189226-
69.2010.8.26.0100 Relator Roque Antônio Mesquita de Oliveira Acórdão de 1º de junho de 2016, publicado no DJE de 14 de 
junho de 2016). Apelação Cível. Ação revisional de contrato bancário. Sentença de improcedência. Inconformismo da autora. "
4,1063449-13.2017.8.26.0100,"Processo Digital. Petições para juntada devem ser apresentadas exclusivamente por meio eletrônico, nos termos do artigo 7º da Res. 551/2011",Apelação,São Paulo, Luiz Antonio Silva ," 
Banco Itaucard S/A "," Joao 
Ortiz Hernandes (OAB: 47984/SP) - Francisco Duque Dabus (OAB: 248505/SP) - Conselheiro Furtado, nº 503 - 4º andar"," DECISÃO MONOCRÁTICA N. 16.019 Civil. Ação de busca e apreensão julgada procedente. Pretensão à reforma manifestada pelo réu. Indeferimento da gratuidade de justiça e determinação, não cumprida, para realização do preparo no prazo de 5 (cinco) dias, sob pena de não conhecimento do apelo. Deserção caracterizada. RECURSO NÃO CONHECIDO. 1. Trata-se de recurso de apelação interposto por Luiz Antonio Silva contra a sentença de fls. 78/79 que julgou procedente a ação de busca e apreensão movida pelo Banco Itaucard S/A. As razões recursais postulam, preliminarmente, a concessão do benefício de justiça gratuita, e, no mérito, a reforma da sentença, para que a ação seja julgada totalmente improcedente. (fls. 81/86). Contrarrazões de apelação às fls. 89/92. Em necessário e prévio juízo de admissibilidade (que por força do CPC, ora 
em vigor, cabe a este relator (artigo 1.010, § 3º, e 1.011, inciso I), proferi a decisão de fls. 94/96, indeferindo os benefícios 
de justiça gratuita, e determinando ao apelante a comprovação nos autos, no prazo de 5 (cinco) dias, do recolhimento do 
preparo, sob pena de deserção. Essa determinação não foi atendida, conforme certidão exarada a fls. 98. 2. A apelação se 
sujeita à disciplina do Código de Processo Civil de 2015 (a sentença foi disponibilizada liberada nos autos digitais em 1 de 
fevereiro de 2018) e não pode ser conhecida. Nos termos do artigo 1.007, caput, do mencionado diploma processual “no ato 
de interposição do recurso, o recorrente comprovará, quando exigido pela legislação pertinente, o respectivo preparo, inclusive 
porte de remessa e de retorno, sob pena de deserção”. Já o artigo 101, caput e § 2º, do mesmo diploma legal, determina que, 
indeferido o pedido de gratuidade, o relator determinará ao recorrente, no prazo de 5 (cinco) dias, o recolhimento do preparo, 
sob pena de não conhecimento do recurso. Bem por isso, no caso em exame, indeferida a fls. 94/96, a gratuidade de justiça 
requerida pela apelante, foi determinada a realização do preparo no prazo legal de cinco dias. Porém, como essa determinação 
não foi atendida, conforme certificado a fls. 98, imperativo é o reconhecimento da deserção, que impede o conhecimento 
deste apelo, como se colhe dos seguintes arestos deste E. Tribunal de Justiça, mutatis mutandis: RECURSO Apelação “Ação 
declaratória de obrigação de fazer c. c. pedido de tutela antecipada e danos morais” Insurgência contra a r. sentença que 
julgou improcedente a demanda Indeferimento da justiça gratuita e concessão de prazo para recolhimento das custas, sob 
pena de deserção Recolhimento apenas da taxa judiciária Conferida nova oportunidade para comprovar o recolhimento da 
taxa de porte de remessa e de retorno, a apelante manteve-se inerte Deserção configurada Inteligência do artigo 1007, § 2º, 
do Novo CPC Recurso não conhecido. (18ª Câmara de Direito Privado Apelação n.  Relator Roque 
Antônio Mesquita de Oliveira Acórdão de 1º de junho de 2016, publicado no DJE de 14 de junho de 2016). Apelação Cível. Ação 
revisional de contrato bancário. Sentença de improcedência. Inconformismo da autora. Pedido de justiça gratuita realizado 
apenas no bojo do recurso. Não comprovação da atual impossibilidade de arcar com o custo do processo. Indeferimento da 
gratuidade. Apelante intimada a recolher o preparo. Inércia que impõe o reconhecimento da deserção. Artigo 511 do Código 
de Processo Civil de 1973. Recurso não conhecido. (22ª Câmara de Direito Privado Apelação n.  
Relator Hélio Nogueira Acórdão de 5 de maio de 2016, publicado no DJE de 13 de maio de 2016). Ação de reintegração de 
posse. Sentença de procedência. Recurso do réu pugnando a inversão do julgado, com pleito de concessão da justiça gratuita. 
Indeferimento por este Relator uma vez ausente os elementos necessários para sua concessão, determinando o recolhimento 
das custas de preparo, sob pena de deserção. Ausência de recolhimento. Apelo deserto. Recurso não conhecido. (32ª Câmara 
de Direito Privado Apelação n.  Relator Ruy Coppola Acórdão de 4 de agosto de 2016, publicado no 
DJE de 11 de agosto de 2016). Enfim, por falta do recolhimento regular do preparo, inobstante o prazo concedido para tanto, 
esta apelação não pode ser conhecida, sendo digno de nota o fato de não ter o apelante interposto recurso de agravo interno 
contra a decisão que indeferiu a gratuidade. No mais, indeferido o pedido de justiça gratuita e, portanto, não conhecido o apelo 
em virtude da deserção, impõe-se a majoração dos honorários advocatícios de 10% para 12% do valor atualizado da causa, a 
teor do disposto no § 11, do artigo 85, do Código de Processo Civil de 2015. 3. Diante do exposto, não conheço deste recurso, 
tendo em vista a ocorrência da deserção, com majoração da verba honorária. P. R. I. - Magistrado(a) Mourão Neto - 
Ortiz Hernandes (OAB: 47984/SP) - Francisco Duque Dabus (OAB: 248505/SP) - Conselheiro Furtado, nº 503 - 4º andar"
5,1055564-09.2016.8.26.0576,"Processo Digital. Petições para juntada devem ser apresentadas exclusivamente por meio eletrônico, nos termos do artigo 7º da Res. 551/2011",Apelação,São José do Rio Preto," Marcelo Ito 
Soares   Leila Carolina Sian da Silva ", Joaquim Silva Teixeiera ," Karen Chiuchi Scatena (OAB: 332232/SP) - Laura Luciana Teixeira de Siqueira (OAB: 232416/SP) - Conselheiro 
Furtado, nº 503 - 5º andar"," Vistos. A ação de cobrança cc indenização por danos morais, deduzida por Joaquim Silva Teixeira contra Marcelo Ito Soares e Leila Carolina Sian da Silva, foi julgada procedente. Em consequência, os réus foram condenados ao pagamento da importância de R$ 12.600,00, relativa ao valor levantado na reclamação trabalhista referida na inicial, além de R$ 10.000,00, a título de indenização por danos morais. Quando da prolação da r. sentença apelada, o I. Juízo de Primeiro Grau determinou aos réus, ora apelantes, que trouxessem aos autos, documentos comprobatórios de sua hipossuficiência, o que foi cumprido a fls. 168/188. Todavia, o pleito de concessão dos benefícios da Justiça Gratuita não foi analisado pelo Juízo a quo. Pois bem. Em sede de Juízo de admissibilidade, observo 
que a análise da documentação carreada aos autos indica que os apelantes fazem jus à benesse da gratuidade. Com efeito, a 
Constituição Federal prevê, em seu art. 5º, inciso LXXIV, que o Estado prestará assistência jurídica integral e gratuita aos que 
comprovarem insuficiência de recursos (g.n.). Em outras palavras, a conclusão que se impõe, do texto da Lei Maior, é a de que os 
benefícios da Assistência Judiciária Gratuita serão concedidos àqueles que demonstrarem, satisfatoriamente, a precariedade de 
sua situação financeira. Nessa linha, o artigo 98 do NCPC, assevera que a pessoa natural ou jurídica, brasileira ou estrangeira, 
com insuficiência de recursos para pagar as custas, as despesas processuais e os honorários advocatícios, tem direito à 
gratuidade da justiça. E, ainda, o artigo 99, §2º, NCPC dispõe que: “O juiz somente pode indeferir o pedido se houver nos autos 
elementos que evidenciem a falta dos pressupostos legais para a concessão de gratuidade, devendo, antes de indeferir o pedido, 
determinar à parte comprovação do preenchimento dos referidos pressupostos”. Pois bem. No caso em tela, de rigor observar 
que as carteiras profissionais trazidas aos autos a fls. 169/173 e 181/184, não se prestam para demonstração da situação de 
desemprego, tendo em conta que os apelantes são advogados e, em consulta levada a efeito nesta data, junto ao site da OAB, 
constatei que suas inscrições encontram-se regulares e ativas. Não obstante, os informes do IR, acostados a fls. 174/176 e 
185/187, dão conta de que os apelantes não apresentaram declaração de Imposto de Renda, nos anos de 2016, 2017 e 2018. 
Ora, se não apresentaram declaração de imposto de renda, a conclusão que se impõe é a de que seus rendimentos mensais 
são inferiores a R$ 1.903,98, rendimento mínimo indicado pela Receita Federal para o exercício de 2017, para obrigatoriedade 
da declaração de renda. Referida quantia é inferior ao montante de três salários mínimos mensais, considerando o ano de 2017, 
paradigma que esta C. 29ª Câmara se utiliza para aferir a hipossuficiência financeira de quem pleiteia a gratuidade da justiça. 
Anote-se, por oportuno, que a mera constituição de advogado não permite, por si só, inferir que a parte não faça jus à gratuidade 
judiciária. Nesse sentido já está consolidada a jurisprudência. Veja-se: “Se a parte indicou advogado, nem por isso deixa de ter 
direito à assistência judiciária (RT 700/119 -  JTJ 320/89: AI 7.169.718-0 -  325/134: AI 489.338.4/4-00), não sendo obrigada, para 
gozar dos benefícios desta, a recorrer aos serviços da Defensoria Pública (STJ, 3ª T., REsp 679.198, Min. Menezes Direito, j. 
21/11/06, DJ 16/4/07 -  STJ, Bol. AASP 1.703/2005, JTJ 301/383).” Aliás, o Novo Código de Processo Civil, em seu artigo 99, §4º, 
é expresso a respeito: “A assistência do requerente por advogado particular não impede a concessão de gratuidade da justiça”. 
Em suma, ante os dados coligidos aos autos e tudo o que foi exposto, a conclusão que se impõe é a de que os apelantes fazem 
jus à benesse da Justiça Gratuita, não podendo passar sem observação a propósito, que segundo dispositivo contido no art. 
99, § 3º., do NCPC, presume-se verdadeira a alegação de insuficiência deduzida exclusivamente por pessoa natural. Eventual 
impugnação poderá ser apresentada pelos apelados, a quem cumprirá a demonstração de que os apelantes não fazem jus ao 
benefício ora concedido. Defiro, pois, aos apelantes, os benefícios da Justiça Gratuita. Anote-se. Presentes os pressupostos de 
admissibilidade, determino que os autos aguardem a ordem cronológica para julgamento. Int. e C.  - Magistrado(a) Neto Barbosa 
Ferreira - 
Furtado, nº 503 - 5º andar"
