,codigo_processo,meio_processo,natureza_processo,comarca,lista_ativos,lista_passivos,lista_advogados,conteudo
18,1102503-83.2017.8.26.0100,"Processo Digital. Petições para juntada devem ser apresentadas exclusivamente por meio eletrônico, nos termos do artigo 7º da Res. 551/2011",Apelação,São Paulo," Cristoph Sena Schlafner 
", Pedro Henrique Lutti Lippe ," 
Paulo Augusto Sena (OAB: 53859/MG) - Paulo Augusto Sena Junior (OAB: 132954/MG) - Mara Iza Pereira Pisani (OAB: 322194/
SP) - Demetrius Dalcin Affonso do Rego (OAB: 320600/SP) - Pátio do Colégio, sala 315"," Magistrado(a) Donegá Morandini - Deram provimento em parte ao recurso. V. U.  - RESPONSABILIDADE CIVIL. AÇÃO DE OBRIGAÇÃO DE FAZER C/C INDENIZAÇÃO POR DANOS MORAIS.I. GRATUIDADE PROCESSUAL. CONCESSÃO IMPERATIVA AO RÉU. PRESUNÇÃO DA DECLARAÇÃO FIRMADA POR PESSOA FÍSICA, NA FORMA DO ARTIGO 99, §3º, DO CÓDIGO DE PROCESSO CIVIL. HIPOSSUFICIÊNCIA RATIFICADA PELA RENDA COMPROVADA PELO INTERESSADO, NÃO HAVENDO QUALQUER INDICATIVO DE SINAIS EXTERIORES DE RIQUEZA. II. PRELIMINAR DE INCOMPETÊNCIA TERRITORIAL. REJEIÇÃO. ATO ILÍCITO PERPETRADO POR MEIO DA REDE MUNDIAL DE COMPUTADORES. DANOS CUJA EXTENSÃO SE COMPREENDE TER OCORRIDO NO DOMICÍLIO DO 
LESADO. ADEQUADA A PROPOSITURA DA DEMANDA NO FORO DE DOMICÍLIO DO AUTOR, À LUZ DO ARTIGO 53, INCISO 
IV, ALÍNEA A, DO CÓDIGO DE PROCESSO CIVIL. PRECEDENTES DO E. SUPERIOR TRIBUNAL DE JUSTIÇA E DESTA 
CORTE.III. SÉRIE DE VÍDEOS PUBLICADOS PELO RÉU, EM CANAL DA PLATAFORMA YOUTUBE, TRATANDO DE MATÉRIA 
EDITADA PELO AUTOR, EM BLOG ESPECIALIZADO SOBRE JOGOS. CONDUTA QUE VEICULA CONTEÚDO INFAMANTE E 
DESMORALIZANTE À PESSOA DO AUTOR. DESVIO DO ESCOPO FINALÍSTICO DA MERA CRÍTICA OU CONTRAPOSIÇÃO 
DE VISÕES ACERCA DO OBJETO EM DISPUTA. TRANSBORDO DOS LIMITES DA LIBERDADE DE EXPRESSÃO, 
ENSEJANDO VIOLAÇÃO À HONRA E À IMAGEM DO AUTOR. LESÃO MORAL CONFIGURADA. IV. VALOR DA INDENIZAÇÃO. 
ARBITRAMENTO EM R$ 5.000,00 (CINCO MIL REAIS). ADEQUAÇÃO. OBSERVÂNCIA AO DISPOSTO NO ARTIGO 944 DO 
CÓDIGO CIVIL. REDUÇÃO INADMISSÍVEL, SOB PENA DE ESVAZIAR EFICACIALMENTE A TUTELA COMPENSATÓRIA 
CABÍVEL.SENTENÇA REFORMADA EM PARTE. APELO PARCIALMENTE PROVIDO. ART. 1007 CPC - EVENTUAL RECURSO 
- SE AO STJ: CUSTAS R$ 179,37 - (GUIA GRU NO SITE http://www.stj.jus.br) - RESOLUÇÃO Nº 2 DE 01/02/2017 DO STJ -  SE 
AO STF: CUSTAS R$ 198,95 - GUIA GRU - COBRANÇA - FICHA DE COMPENSAÇÃO - (EMITIDA ATRAVÉS DO SITE www.
stf.jus.br) E PORTE DE REMESSA E RETORNO R$ 116,20 - GUIA FEDTJ - CÓD 140-6 - BANCO DO BRASIL OU INTERNET 
- RESOLUÇÃO Nº 609 DE 23/04/2018 DO STF. Os valores referentes ao PORTE DE REMESSA E RETORNO, não se aplicam 
aos PROCESSOS ELETRÔNICOS, de acordo com o art. 4º, inciso II, da Resolução nº 609/2018 do STF de 23/04/2018. - 
Paulo Augusto Sena (OAB: 53859/MG) - Paulo Augusto Sena Junior (OAB: 132954/MG) - Mara Iza Pereira Pisani (OAB: 322194/
SP) - Demetrius Dalcin Affonso do Rego (OAB: 320600/SP) - Pátio do Colégio, sala 315"
19,1104998-03.2017.8.26.0100,"Processo Digital. Petições para juntada devem ser apresentadas exclusivamente por meio eletrônico, nos termos do artigo 7º da Res. 551/2011",Apelação,São Paulo," Amil Assistência Médica 
Internacional S.a. ", Cristiane Maria dos Santos Armani ," Gustavo Gonçalves Gomes (OAB: 266894/SP) - Siqueira Castro 
Advogados (OAB: 6564/SP) - Ligia Armani Michaluart (OAB: 138673/SP) - Paulo Michaluart (OAB: 170089/SP) - Pátio do 
Colégio, sala 315"," Magistrado(a) Donegá Morandini - Deram provimento em parte ao recurso. V. U.  - PLANO DE SAÚDE. AÇÃO DE OBRIGAÇÃO DE FAZER.I. NEGATIVA DE COBERTURA AO TRATAMENTO DE RADIOTERAPIA CONFORMACIONAL 3D, INDICADO À AUTORA, ACOMETIDA POR NEOPLASIA DE MAMA, A FIM DE IRRADIAR NEOPLASIA MALIGNA SECUNDÁRIA DO ENCÉFALO E DAS MENINGES CEREBRAIS. FUNDAMENTO NA FALTA DE PREVISÃO DO PROCEDIMENTO NO ROL EDITADO PELA ANS. CARÁTER ABUSIVO RECONHECIDO. EXISTÊNCIA DE PRESCRIÇÃO MÉDICA. PROCEDIMENTO NECESSÁRIO, EM PRINCÍPIO, À TENTATIVA DE RECUPERAÇÃO DA SAÚDE DA PACIENTE. APLICAÇÃO DO DISPOSTO NO ARTIGO 51, INCISO IV, DO CÓDIGO DE DEFESA DO CONSUMIDOR E DAS 
SÚMULAS N. 95 E 102 DESTA CORTE. II. OFENSA, AINDA, AO PRINCÍPIO DA BOA-FÉ QUE DEVE NORTEAR OS CONTRATOS 
CONSUMERISTAS. ATENUAÇÃO E REDUÇÃO DO PRINCÍPIO DO PACTA SUNT SERVANDA. INCIDÊNCIA DO DISPOSTO NO 
ARTIGO 421 DO CÓDIGO CIVIL.III. DANOS MORAIS. CONFIGURAÇÃO. INDEVIDA RECUSA DE COBERTURA QUE IMPÔS 
À PACIENTE DESASSOSSEGO ANORMAL, COM O AGRAVAMENTO DE SEU QUADRO PSICOLÓGICO. PRECEDENTES DO 
E. SUPERIOR TRIBUNAL DE JUSTIÇA. ARBITRAMENTO EM R$ 30.000,00 (TRINTA MIL REAIS). IMPORTE INDENIZATÓRIO 
QUE SE REVELA EXCESSIVO FRENTE AOS PRECEITOS DO ARTIGO 944 DO CÓDIGO CIVIL. MINORAÇÃO DO MONTANTE 
REPARATÓRIO PARA A IMPORTÂNCIA DE R$ 20.000,00 (VINTE MIL REAIS), PRESERVANDO A PROPORCIONALIDADE 
NA ESPÉCIE, DADAS AS CIRCUNSTÂNCIAS DA CAUSA.SENTENÇA REFORMADA EM PARTE. APELO PARCIALMENTE 
PROVIDO. ART. 1007 CPC - EVENTUAL RECURSO - SE AO STJ: CUSTAS R$ 179,37 - (GUIA GRU NO SITE http://www.stj.
jus.br) - RESOLUÇÃO Nº 2 DE 01/02/2017 DO STJ -  SE AO STF: CUSTAS R$ 198,95 - GUIA GRU - COBRANÇA - FICHA DE 
COMPENSAÇÃO - (EMITIDA ATRAVÉS DO SITE www.stf.jus.br) E PORTE DE REMESSA E RETORNO R$ 129,40 - GUIA 
FEDTJ - CÓD 140-6 - BANCO DO BRASIL OU INTERNET - RESOLUÇÃO Nº 609 DE 23/04/2018 DO STF. Os valores referentes 
ao PORTE DE REMESSA E RETORNO, não se aplicam aos PROCESSOS ELETRÔNICOS, de acordo com o art. 4º, inciso 
II, da Resolução nº 609/2018 do STF de 23/04/2018. - 
Advogados (OAB: 6564/SP) - Ligia Armani Michaluart (OAB: 138673/SP) - Paulo Michaluart (OAB: 170089/SP) - Pátio do 
Colégio, sala 315"
20,0000978-98.2014.8.26.0288,Processo Físico,Apelação,Ituverava, Joao Soares Leite Filho ," 
Adriel Carlos Teixeira Bento e outro "," 
Marco Antônio Barbosa de Oliveira (OAB: 250484/SP) - Diego Carneiro Teixeira (OAB: 310806/SP) - Leonardo Valdisser Jaculi 
(OAB: 89534/MG) - Pátio do Colégio, sala 515"," Magistrado(a) Cristina Medina Mogioni - Deram provimento ao recurso. V. U.  - EMENTA: APELAÇÃO CÍVEL. AÇÃO DE REPARAÇÃO DE DANOS MORAIS E MATERIAIS. CONTRATO DE COMPRA E VENDA DE IMÓVEL, EM QUE OS COMPRADORES NÃO AVERBARAM AS MUDANÇAS NA TITULARIDADE. IPTU IMPUTADO AO ANTIGO PROPRIETÁRIO, COM INSCRIÇÃO DE SEU NOME EM DÍVIDA ATIVA. SENTENÇA PARCIALMENTE PROCEDENTE PARA OBRIGAR A PARTE RÉ AO PAGAMENTO DO IPTU E AO REGISTRO DA TITULARIDADE DO IMÓVEL. INDEFERIDO, ENTRETANTO, O PEDIDO DO AUTOR DE INDENIZAÇÃO POR DANO MORAL. RECURSO DO AUTOR COM INSISTÊNCIA DO  RESSARCIMENTO POR DANO MORAL. RECURSO PROVIDO. INSCRIÇÃO DO APELANTE NA DÍVIDA ATIVA É INEQUÍVOCA. DANO MORAL CARACTERIZADO, PELOS TRANSTORNOS CAUSADOS AO AUTOR. INDENIZAÇÃO NO VALOR DE R$ 
3.000,00, CONSIDERADOS OS ELEMENTOS DOS AUTOS. CORREÇÃO MONETÁRIA DESTA DATA E JUROS DE MORA DE 
1% AO MÊS, DA CITAÇÃO. EM RAZÃO DA PROCEDÊNCIA DA TOTALIDADE DA DEMANDA, OS APELADOS DEVEM ARCAR 
INTEGRALMENTE COM AS CUSTAS PROCESSUAIS E COM OS HONORÁRIOS ADVOCATÍCIOS, QUE FICAM FIXADOS EM 
20% DO VALOR DA CONDENAÇÃO. SENTENÇA REFORMADA. RECURSO PROVIDO. ART. 1007 CPC - EVENTUAL RECURSO 
- SE AO STJ: CUSTAS R$ 179,37 - (GUIA GRU NO SITE http://www.stj.jus.br) - RESOLUÇÃO Nº 2 DE 01/02/2017 DO STJ -  SE 
AO STF: CUSTAS R$ 198,95 - GUIA GRU - COBRANÇA - FICHA DE COMPENSAÇÃO - (EMITIDA ATRAVÉS DO SITE www.
stf.jus.br) E PORTE DE REMESSA E RETORNO R$ 98,00 - GUIA FEDTJ - CÓD 140-6 - BANCO DO BRASIL OU INTERNET - 
RESOLUÇÃO Nº 609 DE 23/04/2018 DO STF. Os valores referentes ao PORTE DE REMESSA E RETORNO, não se aplicam 
aos PROCESSOS ELETRÔNICOS, de acordo com o art. 4º, inciso II, da Resolução nº 609/2018 do STF de 23/04/2018. - 
Marco Antônio Barbosa de Oliveira (OAB: 250484/SP) - Diego Carneiro Teixeira (OAB: 310806/SP) - Leonardo Valdisser Jaculi 
(OAB: 89534/MG) - Pátio do Colégio, sala 515"
21,1000293-45.2015.8.26.0060,"Processo Digital. Petições para juntada devem ser apresentadas exclusivamente por meio eletrônico, nos termos do artigo 7º da Res. 551/2011",Apelação,Auriflama,,," Fernando Lucas Furlan (OAB: 272661/SP) - Monica 
Fernandes do Carmo (OAB: 115832/SP) - Elias Corrêa da Silva Júnior (OAB: 296739/SP) - Páteo do Colégio - Salas 203/205"," Apte/Apdo: J. P. de S. (Justiça Gratuita) - Apda/Apte: T. B. S/A - Magistrado(a) Marino Neto - Negaram provimento ao recurso. V. U.  - AÇÃO DECLARATÓRIA DE INEXIGIBILIDADE DE DÉBITO C/C DANOS MORAIS  CARTÃO DE CRÉDITO -  SENTENÇA DE PARCIAL PROCEDÊNCIA - APELAÇÃO DA RÉ- INSCRIÇÃO DOS DADOS DO AUTOR NO CADASTRO DE INADIMPLENTES POR SUPOSTA DÍVIDA  RECURSO DA RÉ REQUERENDO A IMPROCEDÊNCIA DA AÇÃO  AUSÊNCIA DE COMPROVAÇÃO DA EXISTÊNCIA DAS DÍVIDAS  NEGATIVAÇÃO QUE CONFIGURA ATO ILÍCITO E ENSEJA A RESPONSABILIZAÇÃO DA RÉ  SENTENÇA MANTIDA.  RECURSO NÃO PROVIDO. ART. 1007 CPC - EVENTUAL RECURSO - SE AO STJ: CUSTAS R$ 179,37 - (GUIA GRU NO SITE http://www.stj.jus.br) - RESOLUÇÃO Nº 2 DE 01/02/2017 DO STJ -  SE AO STF: CUSTAS R$ 198,95 - GUIA GRU - COBRANÇA 
- FICHA DE COMPENSAÇÃO - (EMITIDA ATRAVÉS DO SITE www.stf.jus.br) E PORTE DE REMESSA E RETORNO R$ 98,00 
- GUIA FEDTJ - CÓD 140-6 - BANCO DO BRASIL OU INTERNET - RESOLUÇÃO Nº 609 DE 23/04/2018 DO STF. Os valores 
referentes ao PORTE DE REMESSA E RETORNO, não se aplicam aos PROCESSOS ELETRÔNICOS, de acordo com o art. 
4º, inciso II, da Resolução nº 609/2018 do STF de 23/04/2018. - 
Fernandes do Carmo (OAB: 115832/SP) - Elias Corrêa da Silva Júnior (OAB: 296739/SP) - Páteo do Colégio - Salas 203/205"
22,1000714-43.2017.8.26.0358,"Processo Digital. Petições para juntada devem ser apresentadas exclusivamente por meio eletrônico, nos termos do artigo 7º da Res. 551/2011",Apelação,Mirassol," Miguel Luis Berrocar (Justiça 
Gratuita) ", Banco BMG S/A ," 
Thales Leonardo Oliveira Marino (OAB: 390057/SP) - Igor Santos Pimentel (OAB: 389062/SP) - Diego Monteiro Baptista (OAB: 
153999/RJ) - Alessandro Okuno (OAB: 285520/SP) - Páteo do Colégio - Salas 203/205"," Magistrado(a) Marino Neto - Julgaram prejudicado o recurso. V. U.  - SENTENÇA - NULIDADE- AÇÃO DECLARATÓRIA DE NULIDADE DE CLÁUSULA CONTRATUAL C. C. REPETIÇÃO DE INDÉBITO EM DOBRO E INDENIZAÇÃO POR DANOS MORAIS  SENTENÇA QUE JULGA PARCIALMENTE PROCEDENTE A AÇÃO, SEM SE REPORTAR À PRETENSÃO DECLARATÓRIA DE NULIDADE  IMPOSSIBILIDADE  DECISÃO CITRA PETITA  SENTENÇA ANULADA.SENTENÇA ANULADA DE OFÍCIO, PREJUDICADO O MÉRITO RECURSAL. ART. 1007 CPC - EVENTUAL RECURSO - SE AO STJ: CUSTAS R$ 179,37 - (GUIA GRU NO SITE http://www.stj.jus.br) - RESOLUÇÃO Nº 2 DE 01/02/2017 DO STJ -  SE AO STF: CUSTAS R$ 198,95 - GUIA GRU - COBRANÇA - FICHA DE COMPENSAÇÃO - (EMITIDA ATRAVÉS DO SITE www.
stf.jus.br) E PORTE DE REMESSA E RETORNO R$ 98,00 - GUIA FEDTJ - CÓD 140-6 - BANCO DO BRASIL OU INTERNET - 
RESOLUÇÃO Nº 609 DE 23/04/2018 DO STF. Os valores referentes ao PORTE DE REMESSA E RETORNO, não se aplicam 
aos PROCESSOS ELETRÔNICOS, de acordo com o art. 4º, inciso II, da Resolução nº 609/2018 do STF de 23/04/2018. - 
Thales Leonardo Oliveira Marino (OAB: 390057/SP) - Igor Santos Pimentel (OAB: 389062/SP) - Diego Monteiro Baptista (OAB: 
153999/RJ) - Alessandro Okuno (OAB: 285520/SP) - Páteo do Colégio - Salas 203/205"
23,1002374-43.2017.8.26.0400,"Processo Digital. Petições para juntada devem ser apresentadas exclusivamente por meio eletrônico, nos termos do artigo 7º da Res. 551/2011",Apelação,Olímpia," Evanildo Cardoso de Oliveira 
(Justiça Gratuita) ", Banco BMG S/A ,," Magistrado(a) Marino Neto - Deram provimento parcial ao recurso, nos termos que constarão do acórdão. V. U.  - AÇÃO DE REPETIÇÃO DE INDÉBITO C/C INDENIZAÇÃO POR DANOS MORAIS  SENTENÇA DE IMPROCEDÊNCIA  APELAÇÃO DO AUTOR- EMPRÉSTIMO SOBRE RESERVA DE MARGEM CONSIGNÁVEL  ALEGAÇÃO "
24,1004591-85.2017.8.26.0068,"Processo Digital. Petições para juntada devem ser apresentadas exclusivamente por meio eletrônico, nos termos do artigo 7º da Res. 551/2011",Apelação,Barueri," Crislaine dos Santos Barreto 
(Justiça Gratuita) ", BANCO BRADESCARD S.A ," Leandro Lúcio Antunes Cunha (OAB: 
332080/SP) - José Antônio Martins (OAB: 340639/SP) - Páteo do Colégio - Salas 203/205"," Magistrado(a) Marino Neto - Negaram provimento ao recurso. V. U.  - AÇÃO DECLARATÓRIA DE INEXISTÊNCIA DE DÉBITO CUMULADA COM INDENIZAÇÃO POR DANOS MORAIS  SENTENÇA DE IMPROCEDÊNCIA  APELAÇÃO DA AUTORA- ALEGAÇÃO DE INCLUSÃO INDEVIDA DO NOME DA AUTORA NO CADASTRO DE INADIMPLENTES  AUSÊNCIA DA AUTORA EM AUDIÊNCIA DE INSTRUÇÃO DESIGNADA TÃO SOMENTE PARA DEPOIMENTO PESSOAL - REJEIÇÃO DO PEDIDO QUE ERA DE RIGOR  SENTENÇA MANTIDA POR SEUS PRÓPRIOS FUNDAMENTOS. RECURSO NÃO PROVIDO. ART. 1007 CPC - EVENTUAL RECURSO - SE AO STJ: CUSTAS R$ 179,37 - (GUIA GRU NO SITE http://www.stj.jus.br) - RESOLUÇÃO Nº 2 DE 01/02/2017 DO STJ -  SE AO STF: CUSTAS R$ 198,95 - GUIA 
GRU - COBRANÇA - FICHA DE COMPENSAÇÃO - (EMITIDA ATRAVÉS DO SITE www.stf.jus.br) E PORTE DE REMESSA E 
RETORNO R$ 116,20 - GUIA FEDTJ - CÓD 140-6 - BANCO DO BRASIL OU INTERNET - RESOLUÇÃO Nº 609 DE 23/04/2018 
DO STF. Os valores referentes ao PORTE DE REMESSA E RETORNO, não se aplicam aos PROCESSOS ELETRÔNICOS, de 
acordo com o art. 4º, inciso II, da Resolução nº 609/2018 do STF de 23/04/2018. - 
332080/SP) - José Antônio Martins (OAB: 340639/SP) - Páteo do Colégio - Salas 203/205"
25,1005696-78.2017.8.26.0624,"Processo Digital. Petições para juntada devem ser apresentadas exclusivamente por meio eletrônico, nos termos do artigo 7º da Res. 551/2011",Apelação,Tatuí," João Batista Soares (Justiça Gratuita) 
", Banco BMG S/A ," Marcio Rosa (OAB: 
261712/SP) - Flavia Almeida Moura Di Latella (OAB: 109730/MG) - Marcelo Tostes de Castro Maia (OAB: 63440/MG) - Páteo do 
Colégio - Salas 203/205"," Magistrado(a) Marino Neto - Negaram provimento ao recurso. V. U.  - AÇÃO DE RESTITUIÇÃO DE VALORES C/C OBRIGAÇÃO DE FAZER E INDENIZAÇÃO POR DANOS MORAIS  SENTENÇA DE IMPROCEDÊNCIA  APELAÇÃO DO AUTOR- EMPRÉSTIMO SOBRE RESERVA DE MARGEM CONSIGNÁVEL  DESCONTOS NA APOSENTADORIA DO AUTOR  COMPROVAÇÃO, PELA INSTITUIÇÃO FINANCEIRA, DA LICITUDE DA TRANSAÇÃO  PRECEDENTES DESTA CORTE  SENTENÇA MANTIDA.RECURSO NÃO PROVIDO. ART. 1007 CPC - EVENTUAL RECURSO - SE AO STJ: CUSTAS R$ 179,37 - (GUIA GRU NO SITE http://www.stj.jus.br) - RESOLUÇÃO Nº 2 DE 01/02/2017 DO STJ -  SE AO STF: CUSTAS R$ 198,95 - GUIA GRU - COBRANÇA - FICHA DE COMPENSAÇÃO - (EMITIDA ATRAVÉS DO SITE www.stf.jus.br) E PORTE 
DE REMESSA E RETORNO R$ 116,20 - GUIA FEDTJ - CÓD 140-6 - BANCO DO BRASIL OU INTERNET - RESOLUÇÃO Nº 
609 DE 23/04/2018 DO STF. Os valores referentes ao PORTE DE REMESSA E RETORNO, não se aplicam aos PROCESSOS 
ELETRÔNICOS, de acordo com o art. 4º, inciso II, da Resolução nº 609/2018 do STF de 23/04/2018. - 
261712/SP) - Flavia Almeida Moura Di Latella (OAB: 109730/MG) - Marcelo Tostes de Castro Maia (OAB: 63440/MG) - Páteo do 
Colégio - Salas 203/205"
26,1007549-43.2016.8.26.0597,"Processo Digital. Petições para juntada devem ser apresentadas exclusivamente por meio eletrônico, nos termos do artigo 7º da Res. 551/2011",Apelação,Sertãozinho," Rui Mendes Martins 
Barbosa (Justiça Gratuita) e outro ", Epc Hotel Orion Ltda Me ,, Magistrado(a) Marino Neto - Negaram provimento ao recurso. V. U.  - AÇÃO DE INDENIZAÇÃO POR DANOS MORAIS - SENTENÇA DE IMPROCEDÊNCIA  APELAÇÃO DOS AUTORES- DANOS MORAIS  INOCORRÊNCIA  PROVAS DOS AUTOS QUE DEMONSTRAM DE FORMA INEQUÍVOCA QUE OS FATOS NÃO PASSARAM DE CONTRATEMPO E DISSABOR DO CONVÍCIO COTIDIANO - REJEIÇÃO DO PEDIDO QUE 
27,1023371-20.2017.8.26.0506,"Processo Digital. Petições para juntada devem ser apresentadas exclusivamente por meio eletrônico, nos termos do artigo 7º da Res. 551/2011",Apelação,Ribeirão Preto," Nayara Cristina Costa da 
Silva (Justiça Gratuita) e outro ", Banco Pan S/A ," Andréa Costa Merlo (OAB: 354322/SP) 
- Paulo Roberto Joaquim dos Reis (OAB: 23134/SP) - Páteo do Colégio - Salas 203/205"," Magistrado(a) Renato Rangel Desinano - Negaram provimento ao recurso. V. U.  - AÇÃO DE INDENIZAÇÃO POR DANOS MORAIS E MATERIAIS C.C REPETIÇÃO DE INDÉBITO  CONTRATO DE FINANCIAMENTO DE VEÍCULO COM ALIENAÇÃO FIDUCIÁRIA  BUSCA E APREENSÃO REALIZADA DIANTE DO INADIMPLEMENTO CONFESSO  INEXISTÊNCIA DE DANOS MORAIS EXERCÍCIO REGULAR DE DIREITO  PRECEDENTES DO C. STJ E DO E. TJSP  HIPÓTESE EM QUE OS VALORES DEPOSITADOS EM JUÍZO FORAM INTEGRALMENTE DEVOLVIDOS  DANOS MATERIAIS NÃO CONFIGURADOS - PEDIDO DE REPETIÇÃO EM DOBRO DO INDÉBITO  AUSÊNCIA DE COMPROVAÇÃO DO PAGAMENTO DE PARCELA INDEVIDA, BEM COMO DA MÁ-FÉ DA INSTITUIÇÃO FINANCEIRA  
SENTENÇA MANTIDA  RECURSO NÃO PROVIDO. ART. 1007 CPC - EVENTUAL RECURSO - SE AO STJ: CUSTAS R$ 179,37 
- (GUIA GRU NO SITE http://www.stj.jus.br) - RESOLUÇÃO Nº 2 DE 01/02/2017 DO STJ -  SE AO STF: CUSTAS R$ 198,95 - 
GUIA GRU - COBRANÇA - FICHA DE COMPENSAÇÃO - (EMITIDA ATRAVÉS DO SITE www.stf.jus.br) E PORTE DE REMESSA 
E RETORNO R$ 116,20 - GUIA FEDTJ - CÓD 140-6 - BANCO DO BRASIL OU INTERNET - RESOLUÇÃO Nº 609 DE 23/04/2018 
DO STF. Os valores referentes ao PORTE DE REMESSA E RETORNO, não se aplicam aos PROCESSOS ELETRÔNICOS, de 
acordo com o art. 4º, inciso II, da Resolução nº 609/2018 do STF de 23/04/2018. - 
- Paulo Roberto Joaquim dos Reis (OAB: 23134/SP) - Páteo do Colégio - Salas 203/205"
28,1031507-63.2017.8.26.0002,"Processo Digital. Petições para juntada devem ser apresentadas exclusivamente por meio eletrônico, nos termos do artigo 7º da Res. 551/2011",Apelação,São Paulo," Aline Corrêa do Amaral (Justiça 
Gratuita) ", C & A Modas LTDA e outro ," Defensoria Pública do Estado de São Paulo (OAB: 999999/DP) - José 
Carlos Garcia Perez (OAB: 104866/SP) - Páteo do Colégio - Salas 203/205"," Magistrado(a) Renato Rangel Desinano - Negaram provimento ao recurso. V. U.  - AÇÃO DE INDENIZAÇÃO POR DANOS MORAIS BANCO DE DADOS  HIPÓTESE EM QUE A AUTORA NÃO COMPROVOU A QUITAÇÃO DO CONTRATO DE EMPRÉSTIMO  REGULARIDADE DAS INSCRIÇÕES EM CADASTROS DESABONADORES  AUSÊNCIA DE COMPROVAÇÃO DE QUE O NOME DA AUTORA PERMANECEU NEGATIVADO, A PARTIR DA DATA DA ENTREGA DE DECLARAÇÃO DE QUITAÇÃO, NO ÂMBITO DE AÇÃO CAUTELAR  SENTENÇA MANTIDA  RECURSO NÃO PROVIDO. ART. 1007 CPC - EVENTUAL RECURSO - SE AO STJ: CUSTAS R$ 179,37 - (GUIA GRU NO SITE http://www.stj.jus.br) - RESOLUÇÃO Nº 2 DE 01/02/2017 DO STJ -  SE AO STF: CUSTAS R$ 198,95 - GUIA GRU - COBRANÇA - FICHA DE 
COMPENSAÇÃO - (EMITIDA ATRAVÉS DO SITE www.stf.jus.br) E PORTE DE REMESSA E RETORNO R$ 129,40 - GUIA 
FEDTJ - CÓD 140-6 - BANCO DO BRASIL OU INTERNET - RESOLUÇÃO Nº 609 DE 23/04/2018 DO STF. Os valores referentes 
ao PORTE DE REMESSA E RETORNO, não se aplicam aos PROCESSOS ELETRÔNICOS, de acordo com o art. 4º, inciso II, 
da Resolução nº 609/2018 do STF de 23/04/2018. - 
Carlos Garcia Perez (OAB: 104866/SP) - Páteo do Colégio - Salas 203/205"
29,1001099-42.2016.8.26.0417,"Processo Digital. Petições para juntada devem ser apresentadas exclusivamente por meio eletrônico, nos termos do artigo 7º da Res. 551/2011",Apelação,Paraguaçu Paulista," Guerino 
Seiscento Transportes S/A ", Elizabeth Moraes Santos (Justiça Gratuita) ," Thales Seiscento 
Baptista (OAB: 324333/SP) - Rodrigo Brandão Rodrigues (OAB: 288421/SP) - Páteo do Colégio - Salas 203/205"," Magistrado(a) Jacob Valente - Deram provimento em parte ao recurso. V. U.  - *APELAÇÃO CÍVEL - RESPONSABILIDADE CIVIL  AÇÃO DE INDENIZAÇÃO POR DANOS MORAIS  TRANSPORTE COLETIVO  PASSAGEIRA PORTADORA DE NECESSIDADES ESPECIAIS  SENTENÇA DE PARCIAL PROCEDÊNCIA  INSURGÊNCIA  NULIDADE DA SENTENÇA  INOCORRÊNCIA  EM QUE PESE A JUNTADA DE VÍDEO POSTERIOR A APRESENTAÇÃO DE DEFESA, FATO É QUE A APELANTE TEVE ACESSO A REFERIDA PROVA E NÃO A IMPUGNOU, NEM PRODUZIU QUALQUER CONTRA PROVA EM AUDIÊNCIA QUE SEQUER COMPARECEU  JULGAMENTO EXTRAPETITA  LIDE QUE FOI JULGADA DENTRO DOS LIMITES APRESENTADOS PELA PREFACIAL E 
QUE SE LIMITOU A ANÁLISE DE VÍCIO NA PRESTAÇÃO DE SERVIÇO  PRELIMINARES AFASTADAS  ELEMENTOS DOS 
AUTOS QUE COMPROVARAM A EXISTÊNCIA DE FALHA NA PRESTAÇÃO DE SERVIÇO  PLATAFORMA ELEVATÓRIA QUE 
NÃO FUNCIONOU EM DUAS SITUAÇÕES  DEFEITO NA APARELHAGEM DE ACESSO AO COLETIVO COMPROVADA - 
RESPONSABILIDADE OBJETIVA DA TRANSPORTADORA (ARTIGO 37, § 6º DA CF, ARTIGO 14 DO CDC, E ARTIGO 734 
DO CÓDIGO CIVIL) QUE INDEPENDE DE CULPA - AUSÊNCIA DE EXCLUDENTES DE RESPONSABILIDADE - DEVER DE 
INDENIZAR, CARACTERIZADO - DANO MORAL CONFIGURADO - INDENIZAÇÃO ARBITRADA EM  R$ 20.000,00 QUE CABE 
SER REDUZIDA PARA R$ 12.000,00  APELO PARCIALMENTE PROVIDO.* ART. 1007 CPC - EVENTUAL RECURSO - SE AO 
STJ: CUSTAS R$ 179,37 - (GUIA GRU NO SITE http://www.stj.jus.br) - RESOLUÇÃO Nº 2 DE 01/02/2017 DO STJ -  SE AO STF: 
CUSTAS R$ 198,95 - GUIA GRU - COBRANÇA - FICHA DE COMPENSAÇÃO - (EMITIDA ATRAVÉS DO SITE www.stf.jus.br) E 
PORTE DE REMESSA E RETORNO R$ 129,40 - GUIA FEDTJ - CÓD 140-6 - BANCO DO BRASIL OU INTERNET - RESOLUÇÃO 
Nº 609 DE 23/04/2018 DO STF. Os valores referentes ao PORTE DE REMESSA E RETORNO, não se aplicam aos PROCESSOS 
ELETRÔNICOS, de acordo com o art. 4º, inciso II, da Resolução nº 609/2018 do STF de 23/04/2018. - 
Baptista (OAB: 324333/SP) - Rodrigo Brandão Rodrigues (OAB: 288421/SP) - Páteo do Colégio - Salas 203/205"
30,1002021-44.2016.8.26.0236,"Processo Digital. Petições para juntada devem ser apresentadas exclusivamente por meio eletrônico, nos termos do artigo 7º da Res. 551/2011",Apelação,Ibitinga," Josiane Ferreira (Justiça 
Gratuita) ", Claro S/A ,," Magistrado(a) Jacob Valente - Negaram provimento ao recurso. V. U.  - *DECLARATÓRIA  INEXISTÊNCIA DE DÍVIDA INSCRITA EM CADASTRO RESTRITIVO, FUNDADA EM FATURAS INADIMPLIDAS DE PRESTAÇÃO DE SERVIÇOS DE TV A CABO  PEDIDO CUMULADO DE INDENIZAÇÃO POR DANOS MORAIS NO MONTANTE DE R$ "
31,1005106-76.2016.8.26.0482,"Processo Digital. Petições para juntada devem ser apresentadas exclusivamente por meio eletrônico, nos termos do artigo 7º da Res. 551/2011",Apelação,Presidente Prudente," Claudinei da 
Silva Camara (Justiça Gratuita) ", Telefônica Brasil S/A ," Emerson Egidio Pinaffi (OAB: 311458/SP) - Monica 
Fernandes do Carmo (OAB: 115832/SP) - Elias Corrêa da Silva Júnior (OAB: 296739/SP) - Páteo do Colégio - Salas 203/205"," Magistrado(a) Jacob Valente - Deram provimento em parte ao recurso. V. U.  - *PRESTAÇÃO DE SERVIÇOS  TELEFONIA MÓVEL  PEDIDO DE DECLARAÇÃO DE INEXIGIBILIDADE DE DÉBITOS COBRADOS APÓS SOLICITAÇÃO DE CANCELAMENTO DOS SERVIÇOS  SENTENÇA DE IMPROCEDÊNCIA  INCONFORMISMO DO AUTOR  PARCIAL ACOLHIMENTO  COBRANÇA DE DÉBITOS RELATIVOS AOS MESES DE MARÇO E ABRIL DE 2015 - DOCUMENTOS ACOSTADOS AOS AUTOS DEMONSTRAM QUE A RÉ COBRA VALORES NA FATURA DO MÊS DE ABRIL/2015 RELATIVO A PERÍODO QUE O AUTOR JÁ HAVIA SOLICITADO O CANCELAMENTO DOS SERVIÇOS  DECLARAÇÃO DE INEXIGIBILIDADE DO DÉBITO QUE SE MOSTRA ADEQUADA, CABENDO O RECÁLCULO DO DÉBITO, 
RESPEITADO O PERÍODO ATÉ O CANCELAMENTO  DANOS MORAIS, CONTUDO, INEXISTENTES - AUSÊNCIA DE 
INSCRIÇÃO DO NOME DO AUTOR NOS ÓRGÃOS DE PROTEÇÃO AO CRÉDITO  SIMPLES COBRANÇAS NÃO CONFIGURAM 
LESÃO À HONRA OBJETIVA DO AUTOR  ALÉM DISSO, DÉBITO DEVIDO, AINDA QUE PARCIAL, QUE NÃO ENSEJA O DEVER 
DE INDENIZAR  SENTENÇA PARCIALMENTE REFORMADA PARA JULGAR A DEMANDA PARCIALMENTE PROCEDENTE  
RECURSO PARCIALMENTE PROVIDO.* ART. 1007 CPC - EVENTUAL RECURSO - SE AO STJ: CUSTAS R$ 179,37 - (GUIA 
GRU NO SITE http://www.stj.jus.br) - RESOLUÇÃO Nº 2 DE 01/02/2017 DO STJ -  SE AO STF: CUSTAS R$ 198,95 - GUIA GRU - 
COBRANÇA - FICHA DE COMPENSAÇÃO - (EMITIDA ATRAVÉS DO SITE www.stf.jus.br) E PORTE DE REMESSA E RETORNO 
R$ 98,00 - GUIA FEDTJ - CÓD 140-6 - BANCO DO BRASIL OU INTERNET - RESOLUÇÃO Nº 609 DE 23/04/2018 DO STF. Os 
valores referentes ao PORTE DE REMESSA E RETORNO, não se aplicam aos PROCESSOS ELETRÔNICOS, de acordo com 
o art. 4º, inciso II, da Resolução nº 609/2018 do STF de 23/04/2018. - 
Fernandes do Carmo (OAB: 115832/SP) - Elias Corrêa da Silva Júnior (OAB: 296739/SP) - Páteo do Colégio - Salas 203/205"
32,1006887-36.2016.8.26.0482,"Processo Digital. Petições para juntada devem ser apresentadas exclusivamente por meio eletrônico, nos termos do artigo 7º da Res. 551/2011",Apelação,Presidente Prudente," Bianca Gasqui Nunes 
(Justiça Gratuita) ", Microcamp Escola de Educação Profissional e Comércio de Livros LTDA ,," Magistrado(a) Jacob Valente - Negaram provimento ao recurso. V. U.  - *APELAÇÃO CIVEL - AÇÃO DE INDENIZAÇÃO POR DANOS MORAIS  CONTRATO DE PRESTAÇÃO DE SERVIÇO EDUCACIONAL - ALEGAÇÃO DE PROMESSA DE EMPREGO  PROPAGANDA ENGANOSA  SENTENÇA DE IMPROCEDÊNCIA  INSURGÊNCIA  ELEMENTOS DOS AUTOS QUE COMPROVAM A EXISTÊNCIA VÁLIDA DA CONTRATAÇÃO DE SERVIÇOS EDUCACIONAIS  AUTORA QUE NÃO NEGA TER PARTICIPADO DO CURSO ADQUIRIDO POR CERTO PERÍODO  DISTRATO QUE FORA REALIZADO E NÃO É OBJETO DE DISCUSSÃO NESTES AUTOS - AUTORA QUE NÃO SE DESINCUMBIU DE SEU ÔNUS DE COMPROVAR A EXISTÊNCIA DA ALEGADA PROPAGANDA ENGANOSA - 
SENTENÇA MANTIDA  SUCUMBÊNCIA MAJORADA - RECURSO DESPROVIDO.* ART. 1007 CPC - EVENTUAL RECURSO 
- SE AO STJ: CUSTAS R$ 179,37 - (GUIA GRU NO SITE http://www.stj.jus.br) - RESOLUÇÃO Nº 2 DE 01/02/2017 DO STJ -  SE 
AO STF: CUSTAS R$ 198,95 - GUIA GRU - COBRANÇA - FICHA DE COMPENSAÇÃO - (EMITIDA ATRAVÉS DO SITE www.
stf.jus.br) E PORTE DE REMESSA E RETORNO R$ 98,00 - GUIA FEDTJ - CÓD 140-6 - BANCO DO BRASIL OU INTERNET - 
RESOLUÇÃO Nº 609 DE 23/04/2018 DO STF. Os valores referentes ao PORTE DE REMESSA E RETORNO, não se aplicam "
